id,text
86227_7,"in 1989, the median home price there was $77,300, or $163,773 in today’s dollars, according to the National Association of Realtors. Today it’<span>s $542,700.</span> “I have been stressed about money since I was 11,” Ms."
86227_29,"Just 11% would be able to amass a 20% down payment within the next five years. • The upshot: Millennial households had an average net worth of about $92,000 in 2016, nearly 40% less than Gen X households (people born between 1965 and 1980) had in 2001, adjusted for inflation, and <span>about 20% less</span> than baby boomer households (born from 1946 to 1964) had in 1989, according to data from the Federal Reserve. So it’s time to kill the idea that student-loan debt is always “good debt,” to admit that buying a house isn’t always the right move, and to refashion these old expectations."
25886_5,"Wages have picked up by 5.6 percent over the past year, a report Friday showed, a far quicker pace than the 2 to 3 percent annual pay gains that were typical during the 2010s. At the same time, the jobless rate fell, to 3.6 percent <span>from 3.8 percent</span>. Unemployment is now just slightly above the half-century lows it had reached before the pandemic."
25886_0,"Rising Wages Are Good News for Workers but Put Pressure on the Fed Wages climbed at a rapid pace in the year through March, a sign that labor shortages are prodding employers to increase wages to retain and attract workers — and a signal that climbing pay could keep inflation elevated, ramping up pressure on the Federal Reserve as it contemplates how much and how quickly to cool down the economy. The central bank is trying to slow demand to a more sustainable pace at a moment when inflation is running at its fastest pace <span>in 40 years</span>. Officials began raising interest rates in March and have suggested that they might increase them by half a percentage point in May — twice as much as usual."
25886_2,"Friday’s employment report probably bolsters the case for a supersized increase. Wages have picked up by 5.6 percent over the past year, a report Friday showed, a far quicker pace than <span>the 2 to</span> 3 percent annual pay gains that were typical during the 2010s. At the same time, the jobless rate fell, to 3.6 percent from 3.8 percent."
25886_2,"Friday’s employment report probably bolsters the case for a supersized increase. Wages have picked up by 5.6 percent over the past year, a report Friday showed, a far quicker pace than <span>the 2 to</span> 3 percent annual pay gains that were typical during the 2010s. At the same time, the jobless rate fell, to 3.6 percent from 3.8 percent."
25886_6,"“The promise of wages moving up is a great thing,” Jerome H. Powell, the Fed chair, said after the central bank’s decision to raise interest rates last month in a bid to cool off the economy. But the increases are “running at levels that are well above what would be consistent <span>with 2 percent</span> inflation, our goal, over time.” With March’s figures, wages are increasing at an even faster rate over the year than they were when Mr. Powell made his remark. Leisure and hospitality pay shot up as wages rose broadly."
76325_5,"The wait for tech workers to get their next gig may not be long, according to October data from ZipRecruiter. <span>About 37 percent</span> of surveyed laid-off tech workers found a new job within one month, and 79 percent were employed within three months. For Meagan Moakes, getting laid off was unfortunately a familiar experience, but this instance may have come at the worst timing as her husband was laid off two days prior."
76325_1,"Data shows the outlook isn’t all that gloomy, just yet. Employers added <span>about 223,000 jobs</span> in December, and the unemployment rate fell to a 3.5 percent, according to the Bureau of Labor Statistics on Friday. The tech layoffs are not entirely a reflection of economic conditions, Rand Ghayad, head of economics and global labor markets at LinkedIn wrote in a recent blog post."
76325_2,"Data shows the outlook isn’t all that gloomy, just yet. Employers added about 223,000 jobs in December, and the unemployment rate fell to <span>a 3.5 percent</span>, according to the Bureau of Labor Statistics on Friday. The tech layoffs are not entirely a reflection of economic conditions, Rand Ghayad, head of economics and global labor markets at LinkedIn wrote in a recent blog post."
76325_2,"Data shows the outlook isn’t all that gloomy, just yet. Employers added about 223,000 jobs in December, and the unemployment rate fell to <span>a 3.5 percent</span>, according to the Bureau of Labor Statistics on Friday. The tech layoffs are not entirely a reflection of economic conditions, Rand Ghayad, head of economics and global labor markets at LinkedIn wrote in a recent blog post."
76325_5,"The wait for tech workers to get their next gig may not be long, according to October data from ZipRecruiter. <span>About 37 percent</span> of surveyed laid-off tech workers found a new job within one month, and 79 percent were employed within three months. For Meagan Moakes, getting laid off was unfortunately a familiar experience, but this instance may have come at the worst timing as her husband was laid off two days prior."
86518_9,"A balance sheet that is smaller than today’s, yet still substantial, would enable the Fed to keep the reverse repos around. It would also support the Fed’s foreign repos for overseas accounts, where weekly balances have averaged $250 billion, up <span>from $30 billion</span> precrisis, as well as the $1.5 trillion in currency outstanding and changing cash-management policies at the Treasury Department. If the Fed reduces its bond portfolio, the burden will be on private market participants to step in."
86518_2,"A long list of programs adopted to help foster economic growth, along with changes in money markets and bank regulation, have vastly expanded the Fed’s balance sheet and its involvement in markets. The Fed’s assets now <span>total $4.5 trillion</span>, up from less than $1 trillion a decade ago. Since 2013 the central bank has become one of the largest traders with U.S. taxable money-market funds, according to Crane Data."
86518_5,"Changes could herald “incoming policy makers who are by nature skeptical of a Fed that continues unorthodox approaches to both monetary and regulatory policy.”  New York Fed President William Dudley told an audience this month the portfolio isn’t likely to return to its precrisis size. Federal Reserve Bank of San Francisco President John Williams said this month the portfolio would be “significantly smaller” than it is today, but likely <span>above $2 trillion</span> in assets. The ultimate size will be closely tied to which system the central bank decides to use to control interest rates in the future."
86518_3,"A long list of programs adopted to help foster economic growth, along with changes in money markets and bank regulation, have vastly expanded the Fed’s balance sheet and its involvement in markets. The Fed’s assets now total $4.5 trillion, up from less <span>than $1 trillion</span> a decade ago. Since 2013 the central bank has become one of the largest traders with U.S. taxable money-market funds, according to Crane Data."
86518_9,"A balance sheet that is smaller than today’s, yet still substantial, would enable the Fed to keep the reverse repos around. It would also support the Fed’s foreign repos for overseas accounts, where weekly balances have averaged $250 billion, up <span>from $30 billion</span> precrisis, as well as the $1.5 trillion in currency outstanding and changing cash-management policies at the Treasury Department. If the Fed reduces its bond portfolio, the burden will be on private market participants to step in."
83235_1,"Retaking Kherson would mark a devastating blow to Russian President Vladimir Putin’s ambitions in Ukraine. The wider region is crucial to providing fresh water to Crimea, a problem that has cost Russia billions of rubles since its illegal annexation of the peninsula <span>in 2014.</span> It is also a key foothold for any future Russian military push in the south toward Odessa, the coveted jewel on the Black Sea."
83235_0,"Waiting on weapons deliveries, Ukrainian gains on the ground have stalled  A soldier, call sign Petrovich, stands in a trench on the Kherson frontline on Aug.<span> 8.</span> Efforts by Ukrainian forces to recapture seized territory have slowed."
83235_0,"Waiting on weapons deliveries, Ukrainian gains on the ground have stalled  A soldier, call sign Petrovich, stands in a trench on the Kherson frontline on Aug.<span> 8.</span> Efforts by Ukrainian forces to recapture seized territory have slowed."
83235_0,"Waiting on weapons deliveries, Ukrainian gains on the ground have stalled  A soldier, call sign Petrovich, stands in a trench on the Kherson frontline on Aug.<span> 8.</span> Efforts by Ukrainian forces to recapture seized territory have slowed."
83235_3,"Ukrainian military officials are tight-lipped on any timeline for a wider push, but say they need more supplies of Western weapons before one can happen. Ukraine lacks the capacity to launch a full-scale offensive anywhere along <span>the 1,200</span>-mile front line, one security official conceded. “We have to be honest — for now, Ukraine doesn’t have a sufficient number of weapons systems for a counteroffensive,” said a defense and intelligence adviser to the Ukrainian government who spoke on the condition of anonymity because he is not authorized to speak to the press."
47642_5,"The new CEO, who will relocate to New York, will have to woo Americans who are reading less. The percentage of U.S. adults who said they had read a book in any format over the past 12 months dropped to 74% last year <span>from 79% in</span> 2011, according to Pew Research Center. Mr. Daunt—who started his career as an investment banker—opened his first bookstore in London in 1990, at the age of 26."
47642_4,"The new CEO, who will relocate to New York, will have to woo Americans who are reading less. The percentage of U.S. adults who said they had read a book in any format over the past 12 months dropped <span>to 74% last</span> year from 79% in 2011, according to Pew Research Center. Mr. Daunt—who started his career as an investment banker—opened his first bookstore in London in 1990, at the age of 26."
47642_4,"The new CEO, who will relocate to New York, will have to woo Americans who are reading less. The percentage of U.S. adults who said they had read a book in any format over the past 12 months dropped <span>to 74% last</span> year from 79% in 2011, according to Pew Research Center. Mr. Daunt—who started his career as an investment banker—opened his first bookstore in London in 1990, at the age of 26."
47642_4,"The new CEO, who will relocate to New York, will have to woo Americans who are reading less. The percentage of U.S. adults who said they had read a book in any format over the past 12 months dropped <span>to 74% last</span> year from 79% in 2011, according to Pew Research Center. Mr. Daunt—who started his career as an investment banker—opened his first bookstore in London in 1990, at the age of 26."
47642_6,"The new CEO, who will relocate to New York, will have to woo Americans who are reading less. The percentage of U.S. adults who said they had read a book in any format over the past 12 months dropped to 74% last year from 79% in<span> 2011,</span> according to Pew Research Center. Mr. Daunt—who started his career as an investment banker—opened his first bookstore in London in 1990, at the age of 26."
34811_3,"“A lot of people have strong beliefs about different things, but we understand that you can come together to win, and we understood that from August 15th,” Bannon said. “We never had a doubt, and Donald Trump never had a doubt that he was going to win.” Priebus and Bannon both emphasized how much of Trump’s agenda is clearly laid out in his speeches, going all the way back to his appearance at <span>CPAC 2011.</span> “What all of us were starving for the whole time, because we’re so sick of politics and politicians — in spite of the fact that we love being here, we actually hate politics — but what we were starving for was somebody real,” Priebus contended."
34811_1,"American Conservative Union President Matt Schlapp hosted a conversation with White House Chief of Staff Reince Priebus and White House strategist Steve Bannon on Thursday at CPAC 2017. Priebus began by declaring that President Trump, who will also speak at CPAC, would become known as “one of the greatest presidents that ever served this country.” Schlapp noted that Trump will also be the first president to address CPAC during his first year in office since Ronald Reagan <span>in 1981,</span> and he congratulated Trump for assembling “the most conservative Cabinet we’ve ever seen, according to our CPAC ratings.” When Schlapp asked for the “biggest misconception about what’s going on in the Donald Trump White House,” Priebus replied: “In regard to us two, I think the biggest misconception is everything that you’re reading.” Priebus and Bannon said that contrary to media reports about friction between them, they’re working very well together. “It’s actually something that you all helped build,” Priebus told the audience."
34811_2,"“When you bring together, and what this election showed, and what President Trump showed — and let’s not kid ourselves, I mean I can talk about data and ground game, and Steve can talk about big ideas, but the truth of the matter is, Donald Trump, President Trump brought together the party and the conservative movement.” The President’s chief of staff went on to say, prompting a burst of applause: And I’ve got to tell you, if the party and the conservative movement are together — similar to Steve and I — it can’t be stopped. And President Trump was the one guy, he was the one person — and I can say it after <span>overseeing 16 people</span> kill each other — it was Donald Trump that was able to bring this party and this movement together. Steve and I know that, and we live it every day."
34811_1,"American Conservative Union President Matt Schlapp hosted a conversation with White House Chief of Staff Reince Priebus and White House strategist Steve Bannon on Thursday at CPAC 2017. Priebus began by declaring that President Trump, who will also speak at CPAC, would become known as “one of the greatest presidents that ever served this country.” Schlapp noted that Trump will also be the first president to address CPAC during his first year in office since Ronald Reagan <span>in 1981,</span> and he congratulated Trump for assembling “the most conservative Cabinet we’ve ever seen, according to our CPAC ratings.” When Schlapp asked for the “biggest misconception about what’s going on in the Donald Trump White House,” Priebus replied: “In regard to us two, I think the biggest misconception is everything that you’re reading.” Priebus and Bannon said that contrary to media reports about friction between them, they’re working very well together. “It’s actually something that you all helped build,” Priebus told the audience."
34811_3,"“A lot of people have strong beliefs about different things, but we understand that you can come together to win, and we understood that from August 15th,” Bannon said. “We never had a doubt, and Donald Trump never had a doubt that he was going to win.” Priebus and Bannon both emphasized how much of Trump’s agenda is clearly laid out in his speeches, going all the way back to his appearance at <span>CPAC 2011.</span> “What all of us were starving for the whole time, because we’re so sick of politics and politicians — in spite of the fact that we love being here, we actually hate politics — but what we were starving for was somebody real,” Priebus contended."
79107_14,"In Asia, Japan’s Nikkei 225 benchmark lost 0.3% and South Korea’s Kospi dipped 0.6%. Mining stocks, which are often sensitive to changes in Chinese macroeconomic policy, led the European markets lower, with Glencore losing 3.8%, Anglo American <span>down 3.1% and</span> BHP down 2.8%. Among the biggest gainers in Europe, shares in British bakery chain Greggs rallied 16%."
79107_0,"Hong Kong Stocks Fall as Violence Builds Stock markets globally were lower as high Chinese inflation reduced the chances of further monetary easing Violence in Hong Kong triggered the largest drop in local stocks since August on Monday, while concerns around U.S.-China trade negotiations continue to weigh on global markets. Hong Kong’s benchmark Hang Seng benchmark closed <span>down 2.6%,</span> the fourth-biggest drop of the year, after police fired gunshots at protesters, and demonstrations across the city forced schools and offices to close early. Futures tied to the S&P 500 index were down 0.4% early Monday."
79107_10,"Analysts say the new data reduced the chances of further monetary easing in China, at least in the coming months. Elsewhere in Asia, Japan’s <span>Nikkei 225 benchmark</span> lost 0.3% and South Korea’s Kospi dipped 0.6%. Stocks to Watch Monday Overall in Europe, the Stoxx Europe 600 dipped 0.5%."
79107_4,"The Hang Seng Index is one of the weakest major stock market performers this year, up just 4%, compared with double-digit gains elsewhere in Asia, the U.S. and Europe. In mainland China, the Shanghai Composite <span>fell 1.8%.</span> Consumer inflation data out over the weekend showed prices soared in October to the highest level in more than seven years, fueled by a continued surge in pork prices."
79107_16,"Mining stocks, which are often sensitive to changes in Chinese macroeconomic policy, led the European markets lower, with Glencore losing 3.8%, Anglo American down 3.1% and BHP down 2.8%. Among the biggest gainers in Europe, shares in British bakery chain Greggs <span>rallied 16%.</span> The company raised its profit outlook for 2019 after it saw sales jump following the launch of its vegan sausage roll earlier this year."
92586_2,"Since then, the outlook for the cryptocurrency has dimmed considerably. After peaking <span>around $20,000 last</span> December, bitcoin’s price has dropped by over 80%. Federal regulators are investigating possible manipulation in bitcoin markets, The Wall Street Journal has reported."
92586_0,"Intercontinental Exchange project is aimed at institutional investors wary of murky cryptocurrency markets  Dec.<span> 20,</span> 2018 5:30 am ET  WASHINGTON—The first futures contract that will pay out in cryptocurrency rather than cash is expected to soon get regulatory approval. The contract, launched by New York Stock Exchange owner Intercontinental Exchange Inc., ICE -1.13%decrease; red down pointing triangle is aimed at institutional players who have stayed out of cryptocurrency markets out of concerns that they are unregulated and susceptible to manipulation."
92586_0,"Intercontinental Exchange project is aimed at institutional investors wary of murky cryptocurrency markets  Dec.<span> 20,</span> 2018 5:30 am ET  WASHINGTON—The first futures contract that will pay out in cryptocurrency rather than cash is expected to soon get regulatory approval. The contract, launched by New York Stock Exchange owner Intercontinental Exchange Inc., ICE -1.13%decrease; red down pointing triangle is aimed at institutional players who have stayed out of cryptocurrency markets out of concerns that they are unregulated and susceptible to manipulation."
92586_0,"Intercontinental Exchange project is aimed at institutional investors wary of murky cryptocurrency markets  Dec.<span> 20,</span> 2018 5:30 am ET  WASHINGTON—The first futures contract that will pay out in cryptocurrency rather than cash is expected to soon get regulatory approval. The contract, launched by New York Stock Exchange owner Intercontinental Exchange Inc., ICE -1.13%decrease; red down pointing triangle is aimed at institutional players who have stayed out of cryptocurrency markets out of concerns that they are unregulated and susceptible to manipulation."
92586_3,"Since then, the outlook for the cryptocurrency has dimmed considerably. After peaking around $20,000 last December, bitcoin’s price has dropped by <span>over 80%.</span> Federal regulators are investigating possible manipulation in bitcoin markets, The Wall Street Journal has reported."
68468_12,"I did not raise the possibility of using the embassy or any other Russian facility for any purpose other than this one possible conversation in the transition period.” The second transition-period meeting Kushner says he had with Russians was on Dec. 13, when Kushner met with Sergey Gorkov, a banker with “a direct line to the Russian President,” at the urging of Kislyak. On Dec.<span> 6,</span> the Russian Embassy asked Kushner to meet with Kislyak on Dec. 7, and Kushner declined, he writes. They asked if he could meet on Dec. 6 and Kushner declined again, he writes."
68468_3,"“While I participated in thousands of calls during this period, I do not recall any such calls with the Russian Ambassador,” Kushner writes. “We have reviewed the phone records available to us and have not been able to identify any calls to any number we know to be associated with Ambassador Kislyak and I am highly skeptical these calls took place.” In fact, Kushner goes on to note that on Nov.<span> 9,</span> the day after the election, when the campaign received a congratulatory note from Russian President Vladimir Putin, Kushner tried to verify it was real and could not remember Kislyak’s name. “So I sent an email asking Mr. Simes, ‘What is the name of the Russian ambassador?’ ” Kushner writes."
68468_9,"“Reviewing emails recently confirmed my memory that the meeting was a waste of our time and that, in looking for a polite way to leave and get back to my work, I actually emailed an assistant from the meeting after I had been there for 10 or so minutes and wrote, ‘Can u pls call me on my cell? Need excuse to get out of meeting.’ ” Kushner writes that he received a “random email” on Oct. 30, 2016, from a screen name “Guccifer400,” which he interpreted as “a hoax” that was “an extortion attempt and threatened to reveal candidate Trump’s tax returns and demanded that we send him 52 bitcoins in exchange for not publishing that information.” Kushner says he brought the email to the attention of a Secret Service agent he was traveling with, who advised him “to ignore it and not to reply — which is what I did.” Kushner also details two interactions with Russian officials during the transition period, before Trump was sworn in as president on Jan.<span> 20.</span> The first, on Dec. 1, was a meeting with Kislyak at Trump Tower in New York, which retired Lt. Gen. Michael Flynn, who would become the president’s national security adviser, also attended."
68468_9,"“Reviewing emails recently confirmed my memory that the meeting was a waste of our time and that, in looking for a polite way to leave and get back to my work, I actually emailed an assistant from the meeting after I had been there for 10 or so minutes and wrote, ‘Can u pls call me on my cell? Need excuse to get out of meeting.’ ” Kushner writes that he received a “random email” on Oct. 30, 2016, from a screen name “Guccifer400,” which he interpreted as “a hoax” that was “an extortion attempt and threatened to reveal candidate Trump’s tax returns and demanded that we send him 52 bitcoins in exchange for not publishing that information.” Kushner says he brought the email to the attention of a Secret Service agent he was traveling with, who advised him “to ignore it and not to reply — which is what I did.” Kushner also details two interactions with Russian officials during the transition period, before Trump was sworn in as president on Jan.<span> 20.</span> The first, on Dec. 1, was a meeting with Kislyak at Trump Tower in New York, which retired Lt. Gen. Michael Flynn, who would become the president’s national security adviser, also attended."
68468_13,"I did not raise the possibility of using the embassy or any other Russian facility for any purpose other than this one possible conversation in the transition period.” The second transition-period meeting Kushner says he had with Russians was on Dec. 13, when Kushner met with Sergey Gorkov, a banker with “a direct line to the Russian President,” at the urging of Kislyak. On Dec. 6, the Russian Embassy asked Kushner to meet with Kislyak on Dec.<span> 7,</span> and Kushner declined, he writes. They asked if he could meet on Dec. 6 and Kushner declined again, he writes."
30666_11,"Even though headline inflation barely rose last month, underlying inflation, which reflects broader economic trends, worsened. A measure that the Federal Reserve Bank of Cleveland uses to track median inflation, which essentially ignores categories with the biggest price swings, <span>rose 0.7% in</span> August. That was the biggest monthly increase since records began in 1983."
