id,text
37263_3,"The companies’ stocks moved lower after the decision was released. Amazon’s was down a little more <span>than 1%,</span> while Wayfair’s stock dropped nearly 7% before recovering slightly. Etsy ’s stock fell about 5%, and eBay ’s was down about 2% in recent trading."
37263_6,"Amazon’s was down a little more than 1%, while Wayfair’s stock dropped nearly 7% before recovering slightly. Etsy ’s stock fell about 5%, and eBay ’s was down <span>about 2% in</span> recent trading. State legislators and big-box stores had been unsuccessful for years in pushing Congress to give states the authority to require sales-tax collection."
69636_5,"The Australian dollar, known as the Aussie, is trading near a two-month low and has dropped more than 3% in the past month. Late Wednesday, the Aussie was <span>at $1.0171,</span> from $1.0185 late Tuesday. At a competing event, the SALT hedge-fund conference in Las Vegas, participants generally were upbeat about the U.S. economy and stock market, with a number comparing the environment to the late 1990s, when the country pulled ahead of other nations in economic growth."
69636_4,"""We think the Australian dollar...will come down and will come down hard,"" Mr. Druckenmiller said, while adding investors should avoid commodity currencies like Brazil and Canada. The Australian dollar, known as the Aussie, is trading near a two-month low and has dropped more <span>than 3% in</span> the past month. Late Wednesday, the Aussie was at $1.0171, from $1.0185 late Tuesday."
69636_4,"""We think the Australian dollar...will come down and will come down hard,"" Mr. Druckenmiller said, while adding investors should avoid commodity currencies like Brazil and Canada. The Australian dollar, known as the Aussie, is trading near a two-month low and has dropped more <span>than 3% in</span> the past month. Late Wednesday, the Aussie was at $1.0171, from $1.0185 late Tuesday."
69636_4,"""We think the Australian dollar...will come down and will come down hard,"" Mr. Druckenmiller said, while adding investors should avoid commodity currencies like Brazil and Canada. The Australian dollar, known as the Aussie, is trading near a two-month low and has dropped more <span>than 3% in</span> the past month. Late Wednesday, the Aussie was at $1.0171, from $1.0185 late Tuesday."
69636_6,"The Australian dollar, known as the Aussie, is trading near a two-month low and has dropped more than 3% in the past month. Late Wednesday, the Aussie was at $1.0171, <span>from $1.0185 late</span> Tuesday. At a competing event, the SALT hedge-fund conference in Las Vegas, participants generally were upbeat about the U.S. economy and stock market, with a number comparing the environment to the late 1990s, when the country pulled ahead of other nations in economic growth."
74724_7,"In return, they rounded up votes and provided other political support. But Chávez, who ruled from 1999 until his death <span>in 2013,</span> was popular. He wasn’t as dependent on the colectivos."
74724_2,"But the neighbors were terrified. “Now we can’t even protest, because they’ll shoot at us,” said Delia Arellano,<span> 72,</span> one of the demonstrators. The attack on Sunday was a chilling sign of how President Nicolás Maduro is increasingly relying on paramilitary groups as he clings to power."
74724_2,"But the neighbors were terrified. “Now we can’t even protest, because they’ll shoot at us,” said Delia Arellano,<span> 72,</span> one of the demonstrators. The attack on Sunday was a chilling sign of how President Nicolás Maduro is increasingly relying on paramilitary groups as he clings to power."
74724_2,"But the neighbors were terrified. “Now we can’t even protest, because they’ll shoot at us,” said Delia Arellano,<span> 72,</span> one of the demonstrators. The attack on Sunday was a chilling sign of how President Nicolás Maduro is increasingly relying on paramilitary groups as he clings to power."
74724_9,"Perhaps the colectivos’ most important weapon, though, is their ability to sow fear. Roberto Patiño, an opposition activist, helped lead demonstrations on Feb.<span> 23 in</span> the Venezuelan border city of Ureña aimed at pressuring security forces to allow humanitarian aid to cross from Colombia. When the Venezuelan National Guard launched tear gas, he said, the crowd persisted."
23728_1,"""Those kinds of choices are just putting families at a real bind."" Inflation hit a 40-year high in June at 9.1%, but food prices increased <span>by 10.4%,</span> according to the Department of Labor. Food banks nationwide have seen long lines as demand surges."
23728_0,"""Those kinds of choices are just putting families at a real bind."" Inflation hit a 40-year high in June <span>at 9.1%,</span> but food prices increased by 10.4%, according to the Department of Labor. Food banks nationwide have seen long lines as demand surges."
23728_0,"""Those kinds of choices are just putting families at a real bind."" Inflation hit a 40-year high in June <span>at 9.1%,</span> but food prices increased by 10.4%, according to the Department of Labor. Food banks nationwide have seen long lines as demand surges."
23728_0,"""Those kinds of choices are just putting families at a real bind."" Inflation hit a 40-year high in June <span>at 9.1%,</span> but food prices increased by 10.4%, according to the Department of Labor. Food banks nationwide have seen long lines as demand surges."
23728_1,"""Those kinds of choices are just putting families at a real bind."" Inflation hit a 40-year high in June at 9.1%, but food prices increased <span>by 10.4%,</span> according to the Department of Labor. Food banks nationwide have seen long lines as demand surges."
71170_10,"At the same time, some of the rental growth among the Moody’s rated malls has slowed. <span>In 2017,</span> the so-called “leasing spread”—the difference between the average rent in new leases versus expiring leases—was 9.6%. That was down from the 11.1% those REITs chalked up in 2016."
71170_5,"But the Moody’s report illustrates that some landlords are being hurt more than others. The average occupancy rate for the retail REITs rated by the firm <span>exceeded 96% at</span> the end of 2017, the report said. “We’re not saying we’re bullish on retail."
71170_7,"For one thing, stock investors have tended to paint the entire sector with a broad brush. As of Tuesday, mall and strip center REITs were trading <span>at 21.6% and</span> 21.5% discounts to the value of their assets, according to Green Street Advisors. The overall REIT market was at a 8.5% discount, the firm said."
71170_6,"But the Moody’s report illustrates that some landlords are being hurt more than others. The average occupancy rate for the retail REITs rated by the firm exceeded 96% at the end <span>of 2017,</span> the report said. “We’re not saying we’re bullish on retail."
71170_10,"At the same time, some of the rental growth among the Moody’s rated malls has slowed. <span>In 2017,</span> the so-called “leasing spread”—the difference between the average rent in new leases versus expiring leases—was 9.6%. That was down from the 11.1% those REITs chalked up in 2016."
36334_14,"Sharif’s PML-N was ahead in 64 constituencies, and the PPP, led by Bilawal Bhutto Zardari, the son of assassinated two-time prime minister Benazir Bhutto, led in 42 constituencies. Although Khan still appeared likely to fall short of <span>the 137 seats</span> needed for a majority in the National Assembly, he should have no problems finding coalition partners from smaller parties and independents. Pakistan’s election monitoring body and the European Union’s were scheduled to deliver their assessments of the conduct of the election on Friday."
36334_1,"His success in Wednesday’s election is a stunning rise for an anti-corruption crusader who has spent much of his political career on the fringes of Pakistan politics, but now stands on the brink of becoming the country’s prime minister. “God has given me a chance to come to power to implement that ideology which I <span>started 22 years</span> ago,” Khan, 65, said in a televised speech from his house near the capital Islamabad. Supporters of jailed former Prime Minister Nawaz Sharif, who accuse Khan of colluding with the still powerful army, said the vote count was rigged in what it termed an assault on democracy in a country with a history of military rule."
36334_8,"The results had been due by around 2 a.m. (2100 GMT on Wednesday). By early Thursday evening, a full day after polls closed, he told <span>reporters 82 percent</span> of results had been received and rejected the allegations of tampering in the vote count. “The complaints we have been receiving, they could be of procedural level, but not any kind of rigging,” Yaqoob said."
36334_7,"Election Commission of Pakistan (ECP) secretary Babar Yaqoob told reporters early on Thursday that counting had been delayed by technical failures in an electronic reporting system and the tallying was now being conducted manually. The results had been due by <span>around 2 a</span>.m. (2100 GMT on Wednesday). By early Thursday evening, a full day after polls closed, he told reporters 82 percent of results had been received and rejected the allegations of tampering in the vote count."
36334_17,"Khan also said he wants deepen ties with old ally Beijing and emulate China’s success in reducing poverty. Investors welcomed Khan’s election success, with Pakistan’s benchmark 100-share index surging as much <span>as 1.9 percent</span> to 42,136 points in early trade, before closing 1.8 percent up. Analysts said there was relief Khan was unlikely to have to rely on major opposition parties in a messy coalition."
26571_2,"Since emerging in China last year, the virus has killed 230,000 people worldwide including 63,000 in the US. The pandemic has seen at <span>least 3.2 million</span> people infected, a million of them Americans, since the virus spread from the city of Wuhan. What did Trump say?"
26571_0,"China has rejected the lab theory and criticised the US response to Covid-19. Since emerging in China last year, the virus has <span>killed 230,000 people</span> worldwide including 63,000 in the US. The pandemic has seen at least 3.2 million people infected, a million of them Americans, since the virus spread from the city of Wuhan."
26571_1,"China has rejected the lab theory and criticised the US response to Covid-19. Since emerging in China last year, the virus has killed 230,000 people worldwide <span>including 63,000 in</span> the US. The pandemic has seen at least 3.2 million people infected, a million of them Americans, since the virus spread from the city of Wuhan."
26571_0,"China has rejected the lab theory and criticised the US response to Covid-19. Since emerging in China last year, the virus has <span>killed 230,000 people</span> worldwide including 63,000 in the US. The pandemic has seen at least 3.2 million people infected, a million of them Americans, since the virus spread from the city of Wuhan."
26571_2,"Since emerging in China last year, the virus has killed 230,000 people worldwide including 63,000 in the US. The pandemic has seen at <span>least 3.2 million</span> people infected, a million of them Americans, since the virus spread from the city of Wuhan. What did Trump say?"
74352_13,"On average, forecasters estimated the probability of a September rate increase at 42%. By comparison, futures markets—where traders make bets on the Fed policy outlook—signal only <span>a 24% chance</span> of the Fed raising rates this month, CME Group said Thursday. Joshua Shapiro, chief U.S. economist at MFR Inc., said he thinks the Fed will start raising rates in October, but still gave a 45% chance of a move in September."
74352_0,"<span>About 46% expect</span> first rate increase at next week’s meeting  Updated Sept. 11, 2015 10:09 am ET  It’s a close call, but most private economists polled think the Federal Reserve will keep short-term interest rates pinned near zero next week. About 46% of business and academic economists surveyed over the past week by The Wall Street Journal predicted the Fed’s first rate increase would come at the Sept. 16-17 policy meeting."
74352_6,"While a plurality picked September, a majority predicted liftoff would arrive at some later meeting. About 9.5% said the Fed would lift off in October, while 35% said the first rate increase would come in December <span>and 9.5% said</span> the central bank would wait until 2016. Expectations for an imminent Fed rate increase have fallen sharply in the past few weeks."
74352_5,"While a plurality picked September, a majority predicted liftoff would arrive at some later meeting. About 9.5% said the Fed would lift off in October, <span>while 35% said</span> the first rate increase would come in December and 9.5% said the central bank would wait until 2016. Expectations for an imminent Fed rate increase have fallen sharply in the past few weeks."
74352_14,"By comparison, futures markets—where traders make bets on the Fed policy outlook—signal only a 24% chance of the Fed raising rates this month, CME Group said Thursday. Joshua Shapiro, chief U.S. economist at MFR Inc., said he thinks the Fed will start raising rates in October, but still gave <span>a 45% chance</span> of a move in September. “It’s a close call, but I do think they haven’t really definitively set markets up for this,” he said."
37311_17,"Water management costs are adding to pressure on copper miners amid a slide in prices—down 32% since highs reached in 2011—deflated by weaker demand, especially in China. But at about $3 a pound, prices are still higher than Freeport's extraction costs in North America of $1.87 a pound, and up from prices that hovered <span>around $1.50 a</span> pound in the 1990s. Analysts say copper prices are relatively resilient, because quality deposits are limited and the metal is essential to a wide variety of goods, from water pipes to iPhones."
37311_14,"""Water is a critical issue in places like Northern Chile and Southern Peru, and here in New Mexico and Arizona,"" Freeport Chief Executive Officer Richard Adkerson said in an interview. Water management costs are adding to pressure on copper miners amid a slide in prices—<span>down 32% since</span> highs reached in 2011—deflated by weaker demand, especially in China. But at about $3 a pound, prices are still higher than Freeport's extraction costs in North America of $1.87 a pound, and up from prices that hovered around $1.50 a pound in the 1990s."
37311_15,"Water management costs are adding to pressure on copper miners amid a slide in prices—down 32% since highs reached in 2011—deflated by weaker demand, especially in China. But at <span>about $3 a</span> pound, prices are still higher than Freeport's extraction costs in North America of $1.87 a pound, and up from prices that hovered around $1.50 a pound in the 1990s. Analysts say copper prices are relatively resilient, because quality deposits are limited and the metal is essential to a wide variety of goods, from water pipes to iPhones."
37311_15,"Water management costs are adding to pressure on copper miners amid a slide in prices—down 32% since highs reached in 2011—deflated by weaker demand, especially in China. But at <span>about $3 a</span> pound, prices are still higher than Freeport's extraction costs in North America of $1.87 a pound, and up from prices that hovered around $1.50 a pound in the 1990s. Analysts say copper prices are relatively resilient, because quality deposits are limited and the metal is essential to a wide variety of goods, from water pipes to iPhones."
37311_17,"Water management costs are adding to pressure on copper miners amid a slide in prices—down 32% since highs reached in 2011—deflated by weaker demand, especially in China. But at about $3 a pound, prices are still higher than Freeport's extraction costs in North America of $1.87 a pound, and up from prices that hovered <span>around $1.50 a</span> pound in the 1990s. Analysts say copper prices are relatively resilient, because quality deposits are limited and the metal is essential to a wide variety of goods, from water pipes to iPhones."
95268_5,"The American Psychiatric Association de-pathologized homosexuality in 1973, when it was removed from the Diagnostic and Statistical Manual of Mental Disorders. Other professional groups quickly followed suit: - <span>In 1975,</span> the American Psychological Association urged its members to help remove the stigma of illness from gay people. - In 1981, the World Health Organization removed homosexuality from its list of mental illnesses."
95268_4,"I think you can choose not to be homosexual."" The American Psychiatric Association de-pathologized homosexuality <span>in 1973,</span> when it was removed from the Diagnostic and Statistical Manual of Mental Disorders. Other professional groups quickly followed suit: - In 1975, the American Psychological Association urged its members to help remove the stigma of illness from gay people."
95268_4,"I think you can choose not to be homosexual."" The American Psychiatric Association de-pathologized homosexuality <span>in 1973,</span> when it was removed from the Diagnostic and Statistical Manual of Mental Disorders. Other professional groups quickly followed suit: - In 1975, the American Psychological Association urged its members to help remove the stigma of illness from gay people."
95268_4,"I think you can choose not to be homosexual."" The American Psychiatric Association de-pathologized homosexuality <span>in 1973,</span> when it was removed from the Diagnostic and Statistical Manual of Mental Disorders. Other professional groups quickly followed suit: - In 1975, the American Psychological Association urged its members to help remove the stigma of illness from gay people."
95268_6,"Other professional groups quickly followed suit: - In 1975, the American Psychological Association urged its members to help remove the stigma of illness from gay people. - <span>In 1981,</span> the World Health Organization removed homosexuality from its list of mental illnesses. - In 1994, the American Medical Association released a report calling for “nonjudgmental recognition of sexual orientation.” - And on June 26, 2015, in Obergefell v. Hodges, the U.S. Supreme Court decided in favor of same-sex marriage, writing that being gay was “a normal expression of human sexuality and immutable.” [Meet Kate Brown: First openly LGBT person elected governor of a state] Vice President-elect Mike Pence has also appeared to support conversion therapy."
10514_7,"Conservatives are rallying to McCrory’s defense of normal society, “as they have the opportunity to hear [him, because] the media has refused to tell the story,” says Tony Perkins, president of the Family Research Council. “I don’t agree with the concept of redefining gender — that is major societal change, but it is being passed off as a political battle,” McCrory told a group of pastors at an Oct.<span> 7 meeting</span> hosted by the Family Research Council. “I’ve had to do a lot of study on this… I’d never heard of it,” until gay advocates threatened to hammer the state’s economy and to spend millions of campaign dollars against him, unless he rejected the state legislation which affirms the difference between men and women."
10514_0,"North Carolina’s GOP governor has closed a 5-point polling gap with his Democratic rival in the last two weeks, as voters push back against the Democrats’ use of the transgender bathroom controversy to tarnish the governor’s successful economic record. On Oct.<span> 1,</span> Gov. Pat McCrory was at 44.2 percent, or 3.6 points behind Attorney General Roy Cooper, according to Real Clear Polling’s average of polling results."
10514_3,"Pat McCrory was at 44.2 percent, or 3.6 points behind Attorney General Roy Cooper, according to Real Clear Polling’s average of polling results. Almost three weeks later, on Oct.<span> 19,</span> McCrory was half a point behind at 46.3 percent, and climbing fast. Local GOP officials are eager to credit McCrory’s economic record for the rise."
10514_2,"On Oct. 1, Gov. Pat McCrory was at 44.2 percent, <span>or 3.6 points</span> behind Attorney General Roy Cooper, according to Real Clear Polling’s average of polling results. Almost three weeks later, on Oct. 19, McCrory was half a point behind at 46.3 percent, and climbing fast."
10514_9,"The law is a compromise because its says that people who want to use public toilets and locker-rooms in the state must use the facility reserved for their male or female sex — but it also allows transgender people to use the opposite sex’s facilities once they’ve undergone surgery and legally changed the sex on their birth certificate. Nationally, only about one in <span>every 2,400 Americans</span> have changed their name from one sex to another, according to a recent study of the 2010 census. Even pro-transgender advocates say that only one in every 160 Americans fit into a very broad definition of “transgender.” That compromise is anathema to gay activists because it legislatively reinforces what they describe as “the gender binary,” which is academic jargon for the public’s view that society consists of male and female, with only a few mixed-sex people in between."
75839_31,"It’s one more reason why many Americans are entering their retirement years as unprepared financially as any generation in years. A 2014 study by the Pew Research Center <span>found 52% of</span> U.S. residents in their 60s—17.4 million people—are financially supporting either a parent or an adult child, up from 45% in 2005. Among them, about 1.2 million support both a parent and a child, more than double the number a decade earlier, according to an analysis of the Pew findings and census data."
75839_0,"By and Heather Gillers | Photographs by Brandon Thibodeaux for The Wall Street Journal  Nov.<span> 16,</span> 2018 10:10 am ET  BENTON COUNTY, Ark.—When Barb Strickert married, she and her husband wrote down a one-year plan for their lives together. And a three-year plan."
75839_17,"She and her husband, Brian, would convert the garage into a recording studio to promote local musicians. * Biden Announces 2024 Re-Election Bid, Setting Up Potential Trump RematchApril 25,<span> 2023,</span> * First Republic Bank Shares Sink 27% After EarningsApril 25, 2023, * McDonald’s, PepsiCo, GM Flex Their Pricing PowerApril 25, 2023,  * Biden Announces 2024 Re-Election Bid, Setting Up Potential Trump RematchApril 25, 2023, * First Republic Bank Shares Sink 27% After EarningsApril 25, 2023, * McDonald’s, PepsiCo, GM Flex Their Pricing PowerApril 25, 2023, * GM Raises 2023 Profit Outlook, Kills Off Chevy Bolt EVApril 25, 2023, * Gap Plans to Lay Off Hundreds of Corporate Workers in Latest CutsApril 25, 2023, * Stocks Fall Ahead of Tech EarningsLive Coverage, * Fox News Ousts Tucker CarlsonApril 24, 2023, * IKEA Redesigns Its Bestsellers, Starting With the Billy BookcaseApril 25, 2023, * The Four Things to Haggle Over When Buying a HomeApril 25, 2023,  The best-laid plans of Barb and Brian have gone awry. One bedroom of the would-be B&B, in their walkout basement, is now occupied by Barb’s 83-year-old mother, and the other by her 34-year-old daughter."
75839_15,"She and her husband, Brian, would convert the garage into a recording studio to promote local musicians. * Biden Announces 2024 Re-Election Bid, Setting Up Potential Trump RematchApril 25,<span> 2023,</span> * First Republic Bank Shares Sink 27% After EarningsApril 25, 2023, * McDonald’s, PepsiCo, GM Flex Their Pricing PowerApril 25, 2023,  * Biden Announces 2024 Re-Election Bid, Setting Up Potential Trump RematchApril 25, 2023, * First Republic Bank Shares Sink 27% After EarningsApril 25, 2023, * McDonald’s, PepsiCo, GM Flex Their Pricing PowerApril 25, 2023, * GM Raises 2023 Profit Outlook, Kills Off Chevy Bolt EVApril 25, 2023, * Gap Plans to Lay Off Hundreds of Corporate Workers in Latest CutsApril 25, 2023, * Stocks Fall Ahead of Tech EarningsLive Coverage, * Fox News Ousts Tucker CarlsonApril 24, 2023, * IKEA Redesigns Its Bestsellers, Starting With the Billy BookcaseApril 25, 2023, * The Four Things to Haggle Over When Buying a HomeApril 25, 2023,  The best-laid plans of Barb and Brian have gone awry. One bedroom of the would-be B&B, in their walkout basement, is now occupied by Barb’s 83-year-old mother, and the other by her 34-year-old daughter."
75839_33,"It’s one more reason why many Americans are entering their retirement years as unprepared financially as any generation in years. A 2014 study by the Pew Research Center found 52% of U.S. residents in their 60s—17.4 million people—are financially supporting either a parent or an adult child, up from 45% in<span> 2005.</span> Among them, about 1.2 million support both a parent and a child, more than double the number a decade earlier, according to an analysis of the Pew findings and census data."
92763_1,"The challenge for Moscow is that the resumption of trading could simply send Russian stocks back into free fall. On Feb. 24, the day when President Vladimir Putin began the assault on Ukraine, the main Russian stock index <span>tumbled 33%.</span> While the index regained a fraction of those losses on Feb. 25—its last day of trading—that was before Western sanctions hammered the ruble and sent the country into an economic crisis."
