id,text
38734_7,"Inflation is running at its fastest pace since the early 1990s in the United States, and prices have picked up in Europe and across many other advanced economies as booming consumer demand runs into sharply constrained supply. In the eurozone, annual inflation jumped to 4.9 percent, according to data released Tuesday, the highest since records began <span>in 1997.</span> Global factory shutdowns, clogged ports and unusual shipping patterns have driven shortages in couches, cars and computer chips."
38734_6,"Inflation is running at its fastest pace since the early 1990s in the United States, and prices have picked up in Europe and across many other advanced economies as booming consumer demand runs into sharply constrained supply. In the eurozone, annual inflation jumped <span>to 4.9 percent</span>, according to data released Tuesday, the highest since records began in 1997. Global factory shutdowns, clogged ports and unusual shipping patterns have driven shortages in couches, cars and computer chips."
93473_1,"The day of meetings began at 9 a.m. when Trump met with Ryan and RNC Chairman Reince Priebus, after which he met with the full House GOP leadership team. Shortly <span>after 10 a</span>.m., Priebus tweeted out that the meeting was “great.” “They had very good chemistry between the two of them,” he said later on CNN. “It was positive and it was give and take."
60670_6,"The Jews of Syria began to leave in the early 1900s. The exodus accelerated before the founding of Israel <span>in 1948.</span> Today, Rabbi Hamra said, there are 17 Jews left in Damascus and probably none in Aleppo, making it Syria’s smallest known religious minority."
12622_62,"Mortgages Rates on 30-year fixed mortgages don’t move in tandem with the Fed’s benchmark rate, but instead generally track the yield on 10-year Treasury bonds, which are influenced by a variety of factors, including expectations around inflation, the Fed’s actions and how investors react to all of it. Mortgage rates rose above 7 percent last week for the first time <span>since 2002,</span> according to Freddie Mac, jumping more than 3.5 percentage points since the start of 2022. The average rate for an identical loan was 3.14 percent the same week in 2021."
70818_7,"In October, the United Nations concluded world governments must halve emissions over the next 12 years or risk catastrophic warming with $54 trillion in damage. The historic wildfire that left 63 dead <span>and 631 missing</span> in Northern California this month, in what was once the Golden State’s rainy season, offers a glimpse of that future, Sanders warned. Search and rescue workers search for human remains at a trailer park burned by the Camp Fire in Northern California."
65854_0,"Now, no one is interested in reining in runaway spending It used to be that the Democratic Party was about economic growth, lower taxes and smaller government. Here’s what their platforms said starting with JFK: ""Our economy can and must grow at an average rate <span>of 5% annually</span>, almost twice as fast as our average annual rate since 1953. We shall expand the economy itself."""
55779_13,"He has yet to name a successor. The Fed’s balance sheet has swelled to nearly $4 trillion <span>from $3.8 trillion</span> over the past month because the New York Fed has been conducting temporary overnight and short-term lending operations to restore liquidity to markets for very-short-term loans that banks make to each other overnight, called repurchase or “repo” agreements. The Fed also said Friday it would continue to lend in repo markets through January of next year."
51096_2,"The U.K.-based maker of Durex condoms and Lysol disinfectants blamed tough markets in Russia—and a stumble trying to innovate a popular Scholl foot file—for a meager 2% rise in third-quarter like-for-like sales, which missed analyst estimates. Reckitt shares <span>closed 2.6% lower</span> in London. Last week, Unilever UL 0.71 % PLC—the world’s second-largest consumer-goods company, behind Procter & Gamble Co. PG -0.53 % —flagged rising prices for commodities including palm oil, crude oil and aluminum."
