id,text
80703_4,"It built Newsstand into its mobile software as a one-stop shop for news apps on Apple devices, but users rarely see it that way—with services such as Flipboard offering a more seamless way to read aggregated news. * China Ratchets Up Pressure on Foreign CompaniesApril 27,<span> 2023,</span> * Amazon Rebounds From Postpandemic Doldrums, but Says Cloud Growth Is SlowingApril 27, 2023, * Stocks Rally, Led by NasdaqApril 27, 2023,  * China Ratchets Up Pressure on Foreign CompaniesApril 27, 2023, * Amazon Rebounds From Postpandemic Doldrums, but Says Cloud Growth Is SlowingApril 27, 2023, * Stocks Rally, Led by NasdaqApril 27, 2023, * Higher Rates Hit U.S. GrowthApril 27, 2023, * Denied a Gun License Over School Threat, Accused Leaker Jack Teixeira Later Got Top-Secret ClearanceApril 27, 2023, * Iran Seizes U.S.-Bound Oil TankerApril 27, 2023, * DeSantis’s Miscalculation: ‘Disney Is Playing the Long Game’April 27, 2023, * U.S. Sanctions Russian, Iranian Security Services Over Wrongful DetentionsApril 27, 2023, * Fire Sale: $300 Million San Francisco Office Tower, Mostly Empty. Open to Offers."
94542_4,"They voted unanimously on Wednesday to leave it there for now. Overall U.S. economic output expanded at <span>a 4.1% annual</span> rate in the second quarter, the best three-month increase since 2014, the Commerce Department reported last week. During the first half of the year, the economy expanded at a 3.1% annual rate, slightly better than the 2.8% median forecast for the full year submitted by Fed officials in June."
69713_9,"“A lot of people feel, ‘Oh, I’m going to play golf and tennis, and those kinds of activities,’ ” she says. “But when you have somebody sit down with an entire week that is blank… they’re at a loss for how they fill that time.” Email: encore@wsj.com -<span> 8 </span>- 8 - - -"
72278_5,"Updated July 1, 2014 3:01 pm ET  The Journal provides  Advertisement - Scroll to Continue  * Fed Says It Failed to Act on Problems That Led to Silicon Valley Bank CollapseApril 28,<span> 2023,</span> * First Republic Stock Plunges AgainLive Coverage, * Wage Gains Pick Up as Fed Considers Rate DecisionApril 28, 2023,  * Fed Says It Failed to Act on Problems That Led to Silicon Valley Bank CollapseApril 28, 2023, * First Republic Stock Plunges AgainLive Coverage, * Wage Gains Pick Up as Fed Considers Rate DecisionApril 28, 2023, * Exxon, Chevron Profits Are Robust as Oil Prices DropApril 28, 2023, * Tech Companies Are Colluding to Cheat H1-B Visa LotteryApril 28, 2023, * In China, a Detention and a New Espionage Law Have Businesses WorriedApril 28, 2023, * World’s Richest Man Likes the View Atop Refurbished TiffanyApril 28, 2023, * I Cloned Myself With AI. She Fooled My Bank and My Family."
73465_4,"--Terri Cullen, 8/9/07  A sampling of low-cost money-market mutual funds  7-day Effective Yield*  Min. Investment  Expense Ratio  Vanguard Prime MF  $3,000  Payden Cash Reserves <span>MMF  $5,000  Vanguard</span> Federal MF  $3,000  TCW Galileo MMF  $2,000  Fidelity US Govt Reserves  $2,500  McMorgan Principal Preservation Fund  $5,000  Source:Bankrate.com  *The 7-day effective yield is the annualized yield based on the most recent 7 days of interest earnings on 08/08/07  87990cbe856818d5eddac44c7b1cdeb8"
55115_0,"Leaders of the world’s wealthiest democracies vowed to end their dependence on Russian energy and ensure that Russia does not triumph in its “unprovoked, unjustifiable and illegal aggression,” as President Vladimir V. Putin pursued his indiscriminate bombardment of eastern Ukraine and orchestrated celebrations for Russia’s Victory Day holiday on Monday. A statement by the Group <span>of 7 major</span> industrialized nations said that on a day when Europe recalled the devastation of World War II and its millions of victims, including those from the Soviet Union, Mr. Putin’s “actions bring shame on Russia and the historic sacrifices of its people.” The leaders, signaling to Mr. Putin that their unrelenting support of Ukraine would only grow, said, “We remain united in our resolve that President Putin must not win his war against Ukraine.” The memory of all those who fought for freedom in World War II, the statement said, obliged them “to continue fighting for it today.” The tone was firm, with no mention of any potential diplomacy or cease-fire. In Moscow, as fighter jets streaked across the sky and nuclear weapons were put on display in preparation for Victory Day, Mr. Putin appeared to signal back to Western leaders that he was determined to double down on the war until he could conjure something that might be claimed as victory."
