id,text
16694_1,"The day before Biden was expected to sign his order, Lori LeBlanc, vice president of LMOGA, emailed an Edwards staffer to request a meeting to “discuss the federal executive orders around the leasing and drilling permit bans on federal lands and offshore,” falsely characterizing the upcoming order as an all-out ban. Documents show she and other representatives of the oil trade group had a Zoom meeting Jan.<span> 27 with</span> Edwards’ staff, including Thomas Harris, secretary of Louisiana’s Department of Natural Resources, and Chip Kline, executive assistant to the governor for coastal activities and the chair of the state’s Coastal Protection and Restoration Authority Board. The following day, LMOGA President Tyler Gray copied Harris in an email to Ryan Flynn, executive director of the New Mexico Oil and Gas Association (NMOGA)."
16694_1,"The day before Biden was expected to sign his order, Lori LeBlanc, vice president of LMOGA, emailed an Edwards staffer to request a meeting to “discuss the federal executive orders around the leasing and drilling permit bans on federal lands and offshore,” falsely characterizing the upcoming order as an all-out ban. Documents show she and other representatives of the oil trade group had a Zoom meeting Jan.<span> 27 with</span> Edwards’ staff, including Thomas Harris, secretary of Louisiana’s Department of Natural Resources, and Chip Kline, executive assistant to the governor for coastal activities and the chair of the state’s Coastal Protection and Restoration Authority Board. The following day, LMOGA President Tyler Gray copied Harris in an email to Ryan Flynn, executive director of the New Mexico Oil and Gas Association (NMOGA)."
23892_9,"The median wait for treatment from a specialist following referral by a general practitioner is 19.8 weeks, according to the Fraser Institute, a Vancouver-based think tank. In 1993, the median wait was less than half as much –<span> 9.3 weeks</span>. Waits are far longer for some specialties."
23892_8,"The median wait for treatment from a specialist following referral by a general practitioner is 19.8 weeks, according to the Fraser Institute, a Vancouver-based think tank. <span>In 1993,</span> the median wait was less than half as much – 9.3 weeks. Waits are far longer for some specialties."
23892_8,"The median wait for treatment from a specialist following referral by a general practitioner is 19.8 weeks, according to the Fraser Institute, a Vancouver-based think tank. <span>In 1993,</span> the median wait was less than half as much – 9.3 weeks. Waits are far longer for some specialties."
27264_15,"… The ads close out by naming the three senators and accusing them of ‘standing in the way of a simple, fair system.’ They provide a phone number for viewers to call the individual Senate offices.” POLL: NORTHAM CRUSHUING GILLESPIE FOR VIRGINIA GOV WaPo: “A relatively unified party base gives Democrat Ralph Northam a clear lead over Republican Ed Gillespie heading into the final month of the Virginia governor’s race, according to a new Washington Post-Schar School poll. Northam leads Gillespie by 53 percent <span>to 40 percent</span> among likely voters, with 4 percent supporting Libertarian Cliff Hyra. The advantage is similar to a Post-Schar School poll this spring but larger than in other public polls of likely voters released over the past month, most of which found Northam up by single digits."
27264_3,"21 TIME OUT: THE PERSISTENCE OF MEMORY Smithsonian: “This morning, the Nobel Prize Committee announced British novelist Kazuo Ishiguro had become the 114th recipient of the Nobel Prize for Literature. Ishiguro is the author of eight books, including 1989’s The Remains of the Day… Known to friends as ‘Ish,’ Ishiguro was born in Nagasaki, Japan, <span>in 1954.</span> But the writer left Japan at the age of five when his father, an oceanographer, was offered a job in the United Kingdom."
27264_4,"- Email us at HALFTIMEREPORT@FOXNEWS.COM with your tips, comments or questions. SCOREBOARD Trump net job-approval rating: -16.2 points Change from one week ago: <span>up 0.8 points</span> [President Trump’s score is determined by subtracting his average job disapproval rating in the five most recent, methodologically sound public polls from his average approval rating, calculated in the same fashion.] I’LL TELL YOU WHAT: IT’S BEEN A WEEK After a long news week, Dana Perino and Chris Stirewalt discuss the tragedy, the response and the political disconnect on the topic of guns, the Virginia governor race and Halo Top ice cream."
37263_4,"The companies’ stocks moved lower after the decision was released. Amazon’s was down a little more than 1%, while Wayfair’s stock dropped <span>nearly 7% before</span> recovering slightly. Etsy ’s stock fell about 5%, and eBay ’s was down about 2% in recent trading."
37263_3,"The companies’ stocks moved lower after the decision was released. Amazon’s was down a little more <span>than 1%,</span> while Wayfair’s stock dropped nearly 7% before recovering slightly. Etsy ’s stock fell about 5%, and eBay ’s was down about 2% in recent trading."
37263_3,"The companies’ stocks moved lower after the decision was released. Amazon’s was down a little more <span>than 1%,</span> while Wayfair’s stock dropped nearly 7% before recovering slightly. Etsy ’s stock fell about 5%, and eBay ’s was down about 2% in recent trading."
69636_5,"The Australian dollar, known as the Aussie, is trading near a two-month low and has dropped more than 3% in the past month. Late Wednesday, the Aussie was <span>at $1.0171,</span> from $1.0185 late Tuesday. At a competing event, the SALT hedge-fund conference in Las Vegas, participants generally were upbeat about the U.S. economy and stock market, with a number comparing the environment to the late 1990s, when the country pulled ahead of other nations in economic growth."
69636_4,"""We think the Australian dollar...will come down and will come down hard,"" Mr. Druckenmiller said, while adding investors should avoid commodity currencies like Brazil and Canada. The Australian dollar, known as the Aussie, is trading near a two-month low and has dropped more <span>than 3% in</span> the past month. Late Wednesday, the Aussie was at $1.0171, from $1.0185 late Tuesday."
69636_4,"""We think the Australian dollar...will come down and will come down hard,"" Mr. Druckenmiller said, while adding investors should avoid commodity currencies like Brazil and Canada. The Australian dollar, known as the Aussie, is trading near a two-month low and has dropped more <span>than 3% in</span> the past month. Late Wednesday, the Aussie was at $1.0171, from $1.0185 late Tuesday."
74724_7,"In return, they rounded up votes and provided other political support. But Chávez, who ruled from 1999 until his death <span>in 2013,</span> was popular. He wasn’t as dependent on the colectivos."
74724_2,"But the neighbors were terrified. “Now we can’t even protest, because they’ll shoot at us,” said Delia Arellano,<span> 72,</span> one of the demonstrators. The attack on Sunday was a chilling sign of how President Nicolás Maduro is increasingly relying on paramilitary groups as he clings to power."
74724_2,"But the neighbors were terrified. “Now we can’t even protest, because they’ll shoot at us,” said Delia Arellano,<span> 72,</span> one of the demonstrators. The attack on Sunday was a chilling sign of how President Nicolás Maduro is increasingly relying on paramilitary groups as he clings to power."
23728_1,"""Those kinds of choices are just putting families at a real bind."" Inflation hit a 40-year high in June at 9.1%, but food prices increased <span>by 10.4%,</span> according to the Department of Labor. Food banks nationwide have seen long lines as demand surges."
23728_0,"""Those kinds of choices are just putting families at a real bind."" Inflation hit a 40-year high in June <span>at 9.1%,</span> but food prices increased by 10.4%, according to the Department of Labor. Food banks nationwide have seen long lines as demand surges."
23728_0,"""Those kinds of choices are just putting families at a real bind."" Inflation hit a 40-year high in June <span>at 9.1%,</span> but food prices increased by 10.4%, according to the Department of Labor. Food banks nationwide have seen long lines as demand surges."
71170_10,"At the same time, some of the rental growth among the Moody’s rated malls has slowed. <span>In 2017,</span> the so-called “leasing spread”—the difference between the average rent in new leases versus expiring leases—was 9.6%. That was down from the 11.1% those REITs chalked up in 2016."
71170_5,"But the Moody’s report illustrates that some landlords are being hurt more than others. The average occupancy rate for the retail REITs rated by the firm <span>exceeded 96% at</span> the end of 2017, the report said. “We’re not saying we’re bullish on retail."
71170_7,"For one thing, stock investors have tended to paint the entire sector with a broad brush. As of Tuesday, mall and strip center REITs were trading <span>at 21.6% and</span> 21.5% discounts to the value of their assets, according to Green Street Advisors. The overall REIT market was at a 8.5% discount, the firm said."
36334_14,"Sharif’s PML-N was ahead in 64 constituencies, and the PPP, led by Bilawal Bhutto Zardari, the son of assassinated two-time prime minister Benazir Bhutto, led in 42 constituencies. Although Khan still appeared likely to fall short of <span>the 137 seats</span> needed for a majority in the National Assembly, he should have no problems finding coalition partners from smaller parties and independents. Pakistan’s election monitoring body and the European Union’s were scheduled to deliver their assessments of the conduct of the election on Friday."
36334_1,"His success in Wednesday’s election is a stunning rise for an anti-corruption crusader who has spent much of his political career on the fringes of Pakistan politics, but now stands on the brink of becoming the country’s prime minister. “God has given me a chance to come to power to implement that ideology which I <span>started 22 years</span> ago,” Khan, 65, said in a televised speech from his house near the capital Islamabad. Supporters of jailed former Prime Minister Nawaz Sharif, who accuse Khan of colluding with the still powerful army, said the vote count was rigged in what it termed an assault on democracy in a country with a history of military rule."
36334_8,"The results had been due by around 2 a.m. (2100 GMT on Wednesday). By early Thursday evening, a full day after polls closed, he told <span>reporters 82 percent</span> of results had been received and rejected the allegations of tampering in the vote count. “The complaints we have been receiving, they could be of procedural level, but not any kind of rigging,” Yaqoob said."
