6150cce0c62a1423bf29fc52,15283,"<h3>Pig Virus Threatens to Bump Pork Cost</h3><span id=""0"" class=""red"">Disease Threatens to Create More Pain for Food Shoppers

Jan.<span id=""0"" class=""yellow"" onclick=""annotateQuant(this);""> 10,</span><span id=""1"" class=""yellow"" onclick=""annotateQuant(this);""> 2014 6</span>:56 pm ET

CHICAGO—A virus that kills young pigs is roiling the U.S. pork industry, boosting prices in <span id=""2"" class=""yellow"" onclick=""annotateQuant(this);"">the $9 billion</span> hog-futures market and threatening to create more pain for food shoppers.

</span><span id=""1"" class=""red"">The disease, which has spread to farms <span id=""3"" class=""yellow"" onclick=""annotateQuant(this);"">in 22 states</span>, is cutting into pork supplies and prompting some traders and investors to wager that hog prices could set records this year.</span> Lean-hog futures rose to a seven-week high a week ago and are <span id=""4"" class=""yellow"" onclick=""annotateQuant(this);"">up 6% since</span> mid-December.

Porcine epidemic diarrhea virus, or the PED virus, appeared in the U.S. for the first time in April and has killed thousands of piglets since then. The virus, which causes severe diarrhea and vomiting, is fatal only to young pigs and poses no threat to human health or food safety, according to swine veterinarians. The U.S. strain is nearly identical to a version that curbed hog production in China <span id=""5"" class=""yellow"" onclick=""annotateQuant(this);"">in 2012.</span>

The extent of the impact is unclear because farms don't have to report incidents or death totals to federal regulators. Smithfield Foods Inc., the world's largest pork producer, and other meatpackers estimate that <span id=""6"" class=""yellow"" onclick=""annotateQuant(this);"">about 10% of</span> the nation's sows, or adult female hogs, have been infected by the virus, which can spread to their offspring.

Smithfield, a unit of China's Shuanghui International Holdings Ltd., said last month the virus could result in a loss to U.S. pig production this year of two million to three million head, or up <span id=""7"" class=""yellow"" onclick=""annotateQuant(this);"">to 3% of</span> the industry's total. <span id=""2"" class=""red"">Hormel Foods Corp., the maker of Spam, warned recently its earnings for <span id=""8"" class=""yellow"" onclick=""annotateQuant(this);"">fiscal 2014 could</span> be affected by ""potentially volatile hog costs"" due to the virus.

</span>To ward off the disease, many U.S. hog farmers are redoubling safety practices, including disinfecting equipment and workers' footwear. But many say they find it difficult to prevent.

""This is the toughest disease we've ever gone through,"" said Mike Brandherm, a general manager with Hitch Pork Producers, a Guymon, Okla., livestock producer that <span id=""9"" class=""yellow"" onclick=""annotateQuant(this);"">lost 30,000 piglets</span> in six weeks in <span id=""10"" class=""yellow"" onclick=""annotateQuant(this);"">a 2013 outbreak</span>. ""It was stunning how fast the disease spread. You feel helpless.""

Though outbreaks at Hitch's farms since then have been smaller, it continues to <span id=""11"" class=""yellow"" onclick=""annotateQuant(this);"">lose 500 to</span><span id=""12"" class=""yellow"" onclick=""annotateQuant(this);""> 600 piglets</span> a week, Mr. Brandherm said. ""We're still not back at the production levels we had prior to the disease,"" he said.

<span id=""3"" class=""red"">The hit to supplies is expected to contribute to higher bacon and pork-chop prices for U.S. consumers as well.</span> <span id=""4"" class=""red"">Retail pork prices likely will set a fresh record this year, breaking the nominal all-time high <span id=""13"" class=""yellow"" onclick=""annotateQuant(this);"">of $3.81 a</span> pound reached in October, according to the U.S. Department of Agriculture.</span> <span id=""5"" class=""red"">The USDA projects <span id=""14"" class=""yellow"" onclick=""annotateQuant(this);"">a 2% to</span><span id=""15"" class=""yellow"" onclick=""annotateQuant(this);""> 3% increase</span> in retail pork prices <span id=""16"" class=""yellow"" onclick=""annotateQuant(this);"">for<span id=""26"" class=""yellow"" onclick=""annotateQuant(this);""> 2014,</span></span> after a gain of <span id=""17"" class=""yellow"" onclick=""annotateQuant(this);"">about 1% last</span> year.

</span><span id=""6"" class=""red"">Mike Boero, the meat-department manager at a Piggly Wiggly grocery store in Zion, Ill., says shoppers already are talking about higher bacon prices.</span> ""It's definitely gone up more than I can afford,"" he said. ""People are only buying it if it's on sale.<span id=""7"" class=""red"">""

Worries about the virus have pushed hog prices higher in the past few months.</span> But many traders said the impact on production likely won't show up in a significant way until spring and summer because the disease began to accelerate in October and piglets take around six months to reach slaughter weight.

<span id=""8"" class=""red"">That sentiment has led to a wider-than-normal disparity in the price of hogs in the front-month contract—February—and for contracts with later dates, according to analysts.</span> On Friday, February hog futures <span id=""18"" class=""yellow"" onclick=""annotateQuant(this);"">rose 0.57 cent</span>, <span id=""19"" class=""yellow"" onclick=""annotateQuant(this);"">or 0.7%,</span> <span id=""20"" class=""yellow"" onclick=""annotateQuant(this);"">to 85.82 cents</span> a pound at the Chicago Mercantile Exchange. <span id=""9"" class=""red"">Prices hit the highest levels for a front-month contract in seven weeks on <span id=""21"" class=""yellow"" onclick=""annotateQuant(this);"">Jan 3.</span>

</span>The June contract, meanwhile, closed <span id=""22"" class=""yellow"" onclick=""annotateQuant(this);"">at $1.009 a</span> pound, about a 15-cent premium over the February contract. Usually, the gap between the February and June hog contracts is <span id=""23"" class=""yellow"" onclick=""annotateQuant(this);"">about 12 cents</span>, according to analysts. <span id=""10"" class=""red"">Prices typically are higher in the summer because hogs tend to eat less when temperatures are high, which keeps them from gaining as much weight and reduces supplies.

</span>""The 900-pound gorilla sitting on those [later futures] contracts is the uncertainty due to PED virus,"" said Mike Zuzolo, president of brokerage Global Commodity Analytics & Consulting in Atchison, Kan.

Some traders and investors are cautious about placing too much emphasis on the virus. <span id=""11"" class=""red"">One factor that could offset the disease's impact on output is U.S. hog farmers are expected to expand their herds this year to take advantage of lower feed prices.</span> <span id=""12"" class=""red"">The cost of corn, typically the main ingredient in livestock feed, has slid <span id=""24"" class=""yellow"" onclick=""annotateQuant(this);"">about 40% in</span> the past year due to a large U.S. crop.</span> This has sharply improved hog farmers' profit margins.

<span id=""13"" class=""red"">Farmers also are packing more pounds on their animals because feed is cheap and they can capture higher prices from meatpackers for greater weights.

</span><span id=""14"" class=""red"">""I think PED is a real threat, but we're going to need to see an actual shortage of pigs hit the market for futures to rally any higher,"" said Craig VanDyke, an analyst with Top Third Ag Marketing, an advisory firm in Chicago.</span> ""These heavier weights can easily make up for even a 2-3% drop in hog numbers.""

Even with the industry bracing for a smaller number of available hogs, the USDA forecasts U.S. pork production will <span id=""25"" class=""yellow"" onclick=""annotateQuant(this);"">rise 2% in</span><span id=""26"" class=""yellow"" onclick=""annotateQuant(this);""> 2014,</span> <span id=""27"" class=""yellow"" onclick=""annotateQuant(this);"">to 23.6 billion</span> pounds, from a year earlier, citing heavier hog weights.

Analysts note that some traders have made wrong bets in the past about how much the virus would affect supplies. For instance, traders who were expecting a big impact were surprised in the early winter to see U.S. hog supplies remain on par with a year earlier. That sent hog futures to an eight-month low on Dec.<span id=""28"" class=""yellow"" onclick=""annotateQuant(this);""> 11.</span>

A question looming over the pork industry is whether farmers seeking to expand their herds will have their plans snuffed out by the appearance of the virus in their barns.

As of the first week of January,<span id=""29"" class=""yellow"" onclick=""annotateQuant(this);""> 2,084 separate</span> positive cases of the virus have been reported to the National Animal Health Laboratory Network, which tracks the disease. Each case may represent anywhere from one infected animal on a farm to thousands across a producer's operations. The U.S. has <span id=""30"" class=""yellow"" onclick=""annotateQuant(this);"">about 68,300 hog</span> farms, according to the USDA. Furthermore, these cases have no clear correlation with the number of deaths caused by the disease.

The industry is trying to develop vaccines to thwart the PED virus, but so far none is in widespread use. Researchers are unsure how the virus, first identified in the U.K. <span id=""31"" class=""yellow"" onclick=""annotateQuant(this);"">in 1971,</span> entered the U.S.

Phil Borgic, a hog farmer in Nokomis, Ill., said he has invested at <span id=""32"" class=""yellow"" onclick=""annotateQuant(this);"">least $5 million</span> in new facilities, enhanced ""biosecurity"" safeguards and new breeding animals in the past few months as he seeks to ramp up output while keeping the virus out of his herd.

Mr. Borgic <span id=""33"" class=""yellow"" onclick=""annotateQuant(this);"">spent $150,000 to</span> build a station where trailers that transport his pigs to packing plants must be washed and dried. Visitors to his barns must shower and put on new clothes and boots.

""We're doing whatever we can to keep it out,"" the 57-year-old said in an interview earlier this month.

On Friday, Mr. Borgic said that he'd discovered infected piglets on his farm.

<span id=""15"" class=""red"">Rich Nelson, chief strategist with brokerage Allendale Inc. in McHenry, Ill., said he thinks prices for hogs this summer could break the record closing high <span id=""34"" class=""yellow"" onclick=""annotateQuant(this);"">of $1.0745 a</span> pound set in <span id=""35"" class=""yellow"" onclick=""annotateQuant(this);"">August 2011.</span></span> ""It appears that PED virus issues are going to beat out any herd expansion in<span id=""26"" class=""yellow"" onclick=""annotateQuant(this);""> 2014,</span>"" Mr. Nelson said.

Write to Kelsey Gee at kelsey.gee@wsj.com

87990cbe856818d5eddac44c7b1cdeb8",1,,,,,,,3,,,,,,,4,,,,,,,,,,,,,,
6150cce0c62a1423bf29fc52,3307,"<h3>Super Bowl 2022 Live Updates: The Rams and Bengals to Face Off</h3>Super <span id=""0"" class=""yellow"" onclick=""annotateQuant(this);"">Bowl 2022 Live</span> Updates: The Rams and Bengals to Face Off
The upstart Cincinnati Bengals will try to prevent the Los Angeles Rams from getting a Hollywood ending to their season.
The final showdown of the N.F.L. season arrives Sunday with what fans hope will be a fitting climax to a wild playoffs, with the Cincinnati Bengals and the Los Angeles Rams facing off in the Super Bowl.
The Bengals are in their first Super Bowl <span id=""1"" class=""yellow"" onclick=""annotateQuant(this);"">in 33 years</span>, led by the rising star quarterback Joe Burrow, who in college won a Heisman Trophy and a national championship with Louisiana State. The Rams have constructed a powerful team through trades and acquisitions, including swapping quarterback Jared Goff for Matthew Stafford in the off-season, and building around the pass rusher Aaron Donald on defense. That aggressive approach to roster building has the Rams playing for a title in SoFi Stadium, their home venue.
In the United States, the game will be televised on NBC and streamed in several places, including Peacock, NBC’s website and the NBC Sports app, while Telemundo will provide coverage in Spanish.
Kickoff is scheduled for about 6:30 p.m. Eastern time — 3:30 p.m. Pacific at SoFi Stadium in Inglewood, Calif. The pregame festivities began on NBC at noon Eastern, with football coverage sandwiched by Olympic action from the Beijing Games. Hey, there’s even an ice dance final that will probably be rolling during the Super Bowl’s second half, so don't be surprised if NBC does a few look-ins.
Outside the U.S., some of the broadcasters include Seven Network (Australia), CTV (Canada), L’Équipe (France), DAZN (Germany), SportKlub (Macedonia) and the BBC (United Kingdom).
After the Los Angeles Rams left for St. Louis <span id=""2"" class=""yellow"" onclick=""annotateQuant(this);"">in 1995,</span> generations of young football fans in this year’s Super Bowl host city grew up without a local N.F.L. team to cheer on. The Raiders, who had been there since the early 1980s, also returned to Oakland that year.
Local sports fans had the superstars of the Los Angeles Lakers to idolize. They could enjoy the esteemed Los Angeles Dodgers. Many were still devoted to the Raiders. They had college football and basketball, the N.H.L. and other teams. But with the Rams gone <span id=""3"" class=""yellow"" onclick=""annotateQuant(this);"">for 20 years</span>, pro football loyalties for Angelenos spread widely across many other clubs, including to the Chargers in San Diego.
Now, after being back in Los Angeles since <span id=""4"" class=""yellow"" onclick=""annotateQuant(this);"">the 2016 season</span>, the Rams will play in the Super Bowl at their home stadium with a chance to recapture the long-term allegiance of their hometown fans.
“When you get a chance to play in the Super Bowl, that always helps win hearts and minds,” Kevin Demoff, the Rams’ chief operating officer, said at a recent news conference.
<span id=""0"" class=""red"">Demoff said that the Rams have cultivated the Los Angeles fan base with star players like Cooper Kupp and Aaron Donald, but as seen by the large crowds of 49ers fans at the regular-season finale and N.F.C. championship game, the team still has work to do in the Los Angeles market.
</span><span id=""1"" class=""red"">“You cannot get to be at the pinnacle of this market by having one great season,” Demoff said.</span> <span id=""2"" class=""red"">“You get to the pinnacle of this market by having great season after great season, after great decade after great decade, and building fans and generations of fans.</span> And that only comes with sustained success.”
Temperatures could climb into the mid-80s this afternoon at SoFi Stadium near Los Angeles, or more <span id=""5"" class=""yellow"" onclick=""annotateQuant(this);"">than 20 degrees</span> higher than normal for February, which could make this the warmest Super Bowl on record. The National Weather Service issued a heat advisory for the area on Friday, and it remains in effect <span id=""6"" class=""yellow"" onclick=""annotateQuant(this);"">until 6 p</span>.m. Pacific.
It’s been <span id=""7"" class=""yellow"" onclick=""annotateQuant(this);"">nearly 50 years</span> since the mercury was so high at a Super Bowl, according to the Pro Football Hall of Fame. The temperature at kickoff <span id=""8"" class=""yellow"" onclick=""annotateQuant(this);"">was 84 degrees</span> at Super Bowl VII <span id=""9"" class=""yellow"" onclick=""annotateQuant(this);"">in 1973,</span> which was also held in Los Angeles. At Super Bowl XXXVII <span id=""10"" class=""yellow"" onclick=""annotateQuant(this);"">in 2003 in</span> San Diego, it <span id=""11"" class=""yellow"" onclick=""annotateQuant(this);"">was 81 degrees</span> at kickoff.
Across the country, cities are smashing heat records more frequently as climate change widens the extremes of temperature ranges worldwide: More heat and cold records were set in the United States last year than in any other year <span id=""12"" class=""yellow"" onclick=""annotateQuant(this);"">since 1994,</span> according to a New York Times analysis. Most of those were heat records, which were set <span id=""13"" class=""yellow"" onclick=""annotateQuant(this);"">at 8.3 percent</span> of all weather stations nationwide last year.
SoFi Stadium is open-sided to let in breezes off the Pacific Ocean. <span id=""14"" class=""yellow"" onclick=""annotateQuant(this);"">In 2028,</span> the stadium will host the opening and closing ceremonies of the Los Angeles Summer Olympics, which will take place during what is usually an even hotter time of year: July and August.
Here are where temperature records were broken in 2021:
A common refrain from Cincinnati Bengals players this week, including stars like Joe Burrow and Ja’Marr Chase, has been that this year’s Super Bowl is “just another game.”
“Obviously it’s not, there are only two teams left and it is for a ring, but I think the best way to go about it is to try to treat it like another game,” Burrow said after Friday’s practice, the last of the season.
Their opponent, the Los Angeles Rams, played in a Super Bowl just three years ago, a 13-3 loss to the New England Patriots. The Bengals, meanwhile, had not won a playoff game since <span id=""15"" class=""yellow"" onclick=""annotateQuant(this);"">the 1990 wild</span>-card round. This year’s Cincinnati team is also the youngest Super Bowl roster ever, with an average age <span id=""16"" class=""yellow"" onclick=""annotateQuant(this);"">of 25.8 years</span>, according to an analysis by the website FiveThirtyEight.
But despite the Bengals’ relative youth, Coach Zac Taylor pointed to the big-stage experience many of his players earned in college or on other N.F.L. teams. Taylor,<span id=""17"" class=""yellow"" onclick=""annotateQuant(this);""> 38,</span> is in just his third season as a head coach but was the quarterbacks coach for the Rams in Super Bowl LIII.
He said that he and Duke Tobin, the team’s director of player personnel, intentionally built the team around players with postseason experience.
“They certainly are not overwhelmed by these moments — they have proven that over the last two months,” Taylor said. “It’s a lot of guys who have played in championships in college, whether it was at L.S.U. or Clemson or Alabama or Ohio State. And then a lot of these free agents we’ve signed, they have been a part of playoff teams before. So these guys, they know they belong on this stage.”
Nine Bengals players, including Burrow and Chase, won a national championship in college. Trey Hendrickson and Mike Daniels were among the free-agent signings who had playoff experience with their previous teams, the New Orleans Saints and Green Bay Packers.
When Von Miller, the former Denver Broncos linebacker, was traded to the Rams in November, he said he cried tears of both joy and sadness.
Miller said in a news conference in November that on one hand, it hurt to leave the only organization he had been with after a decade. Then, Miller added, he realized he was going to play alongside one of the best players in football: the Rams All-Pro defensive lineman Aaron Donald.
<span id=""3"" class=""red"">Donald and Miller have been an elite pairing since that trade, particularly in the postseason.</span> In three playoff games, they each have a <span id=""18"" class=""yellow"" onclick=""annotateQuant(this);"">combined 32 pressures</span> and four sacks, according to Pro Football Focus.
Blocking Donald and Miller will present a huge test for the Bengals’ offensive line, which is its weakest unit on offense. Joe Burrow was the most sacked quarterback (51) in football in the regular season and has <span id=""19"" class=""yellow"" onclick=""annotateQuant(this);"">taken 12 sacks</span> in the postseason.
Burrow was sacked only once against Kansas City in the A.F.C. championship game, mostly because of how quickly he started getting the ball out his hands. That could potentially help neutralize the Rams’ pass rush if the Bengals can’t protect Burrow in a clear mismatch at the line of scrimmage.
<span id=""4"" class=""red"">Ticket prices for this year’s Super Bowl between the Los Angeles Rams and Cincinnati Bengals are unlikely to hit any records.</span> The cheapest resale ticket was going <span id=""20"" class=""yellow"" onclick=""annotateQuant(this);"">for $3,450 on</span> StubHub on Saturday. <span id=""5"" class=""red"">Not cheap, of course, but well below the average price <span id=""21"" class=""yellow"" onclick=""annotateQuant(this);"">of $6,697 for</span> sold tickets, according to StubHub.
</span><span id=""6"" class=""red"">One factor playing into prices: The Rams are playing in their home stadium.</span> Fans in Los Angeles can see the team regularly during the season and have less incentive to shell out thousands more for one game. And because many fans of the team can go to the game without hopping on a flight, they have been able to wait until closer to the game to decide whether to go.
The Bengals play in one of the league’s smallest markets, but their fans haven’t seen Cincinnati play in a Super Bowl in more <span id=""22"" class=""yellow"" onclick=""annotateQuant(this);"">than 30 years</span>. In the last day,<span id=""23"" class=""yellow"" onclick=""annotateQuant(this);""> 30 percent</span> of the people who bought tickets on StubHub were from Ohio <span id=""24"" class=""yellow"" onclick=""annotateQuant(this);"">and 13 percent</span> were from Kentucky (Cincinnati is on the Ohio River, which serves as a border between the two states).
While the number of recorded coronavirus infections among N.F.L. players and coaches has fallen sharply during the playoffs, measures will be in place to limit coronavirus spread for attendees of the Super Bowl.
All fans at SoFi Stadium over the age <span id=""25"" class=""yellow"" onclick=""annotateQuant(this);"">of 5 must</span> show proof of vaccination, or a negative P.C.R. test taken <span id=""26"" class=""yellow"" onclick=""annotateQuant(this);"">within 48 hours</span> of the game, or a negative antigen test taken <span id=""27"" class=""yellow"" onclick=""annotateQuant(this);"">within 24 hours</span>. Attendees over the age <span id=""28"" class=""yellow"" onclick=""annotateQuant(this);"">of 2 are</span> required to wear a mask during the game, except when actively eating or drinking. Free KN95 masks will be distributed on-site.
Los Angeles County has had a mask mandate covering outdoor “mega” events since August. SoFi Stadium has an indoor-outdoor design with a translucent roof and open air flow through the sides of the building.
Away from the stadium, public health experts also recommend that people gathering for Super Bowl parties take similar precautions. The Super Bowl, which draws <span id=""29"" class=""yellow"" onclick=""annotateQuant(this);"">about 100 million</span> TV viewers, is one of the biggest congregate family gathering events of the year, said Robby Sikka, a physician and chair of the Covid Sports and Society Workgroup.
“You’re going to see a spike across the country, unless we emphasize masking, getting the booster and testing,” Sikka said. “You should test to go to your Super Bowl party.”",,6,,,,,,,4,,,,,,,5,,,,,,,,,,,,,
