60b964cbdd0817815f7c3d32,7402,"<h3>Coronavirus Live Updates: U.S. Unemployment Hits Highest Levels Since Great Depression</h3>COVID-19, the disease caused by the coronavirus, was officially declared a pandemic by the World Health Organization on <span id=""0"" class=""yellow"" onclick=""annotateQuant(this);"">March 11.</span>
More <span id=""1"" class=""yellow"" onclick=""annotateQuant(this);"">than 3.8 million</span> cases of the virus have been confirmed worldwide, and more <span id=""2"" class=""yellow"" onclick=""annotateQuant(this);"">than 270,000 people</span> have died from it, according to data compiled by Johns Hopkins University. <span id=""0"" class=""red"">Efforts to curb the outbreak have led to the global disruption of daily life and the economy, as schools and workplaces shutter in hopes of slowing transmission.
</span>HuffPost reporters around the world are tracking the pandemic and the measures being taken to flatten the curve of transmission.
Read the latest updates on the coronavirus pandemic below. (To see the latest updates, you may need to refresh the page. All times are Eastern. For earlier updates on the pandemic, go here.)
<span id=""1"" class=""red"">U.S. Unemployment Rate Shoots Up</span> <span id=""3"" class=""yellow"" onclick=""annotateQuant(this);"">To 14.7% in</span> April — 5/8/20, 8:40 a.m. <span id=""2"" class=""red"">ET
Unemployment in the United States has reached its highest levels since the Great Depression, a horrifying milestone that may take the country years to recover from.
</span><span id=""3"" class=""red""><span id=""4"" class=""yellow"" onclick=""annotateQuant(this);"">Some 20.5 million</span> jobs disappeared in the worst monthly loss on record, meaning that nearly all of the job growth since <span id=""5"" class=""yellow"" onclick=""annotateQuant(this);"">the 2008 recession</span> has been lost in one month.
</span><span id=""4"" class=""red"">The new coronavirus has wrought economic devastation with stunning speed, considering the unemployment rate was <span id=""6"" class=""yellow"" onclick=""annotateQuant(this);"">just 3.5% in</span> February.</span> During the Great Depression, that figure reached <span id=""7"" class=""yellow"" onclick=""annotateQuant(this);"">nearly 25%.</span>
In New York, the epicenter of the public health crisis, a statewide pause on eviction proceedings was enacted so families struggling the most do not have to pay rent during the crisis. Across the country, Americans have turned to food banks as they go weeks without paychecks.
— Sara Boboltz
New York Extends Ban On Evictions Through August — 5/7/2020, 1:19 p.m. ET
New York Gov. Andrew Cuomo (D) announced some extra protections for renters in his state on Thursday. They include a moratorium on evictions due to nonpayment of rent until Aug.<span id=""8"" class=""yellow"" onclick=""annotateQuant(this);""><span id=""10"" class=""yellow"" onclick=""annotateQuant(this);""> 20,</span></span> which extends the <span id=""9"" class=""yellow"" onclick=""annotateQuant(this);"">ban 60 days</span> past its original end date in June. It applies to both residential and commercial tenants.
“People literally are worried about being able to pay rent. You don’t work for two months and that rent bill keeps coming in,” he said at a press conference Thursday.
Cuomo added that he is banning any fees on late rent payments. Additionally, landlords must continue to let tenants dip into their security deposits to pay rent.
“I hope it gives families a deep breath. Nothing can happen until Aug.<span id=""8"" class=""yellow"" onclick=""annotateQuant(this);""><span id=""10"" class=""yellow"" onclick=""annotateQuant(this);""> 20,</span></span>” he said, noting they will continue to assess the situation between now and then.
<span id=""5"" class=""red"">― Lydia O’Connor
<span id=""11"" class=""yellow"" onclick=""annotateQuant(this);""><span id=""12"" class=""yellow"" onclick=""annotateQuant(this);"">Nearly 3.2 million</span></span> More Americans Filed For Unemployment Last Week — 5/7/20, 9:02 a.m.</span> <span id=""6"" class=""red"">ET
<span id=""11"" class=""yellow"" onclick=""annotateQuant(this);""><span id=""12"" class=""yellow"" onclick=""annotateQuant(this);"">Nearly 3.2 million</span></span> laid-off workers in the U.S. applied for unemployment aid last week, bringing the total number of Americans who have filed unemployment claims since the coronavirus pandemic forced widespread business shutdowns <span id=""13"" class=""yellow"" onclick=""annotateQuant(this);"">to 33.5 million</span>, The Associated Press reports.
</span>One in five Americans who had been in the workforce as of February have now been laid off.
<span id=""7"" class=""red"">The pandemic has caused the country’s worst economic downturn in decades.</span> <span id=""8"" class=""red"">The Department of Labor’s April jobs report, which will be issued Friday, is expected to be the worst one <span id=""14"" class=""yellow"" onclick=""annotateQuant(this);"">in 60 years</span>.</span> <span id=""9"" class=""red"">Economists predict the U.S. unemployment rate will reach at <span id=""15"" class=""yellow"" onclick=""annotateQuant(this);"">least 16%,</span> the highest since the Great Depression.
</span><span id=""10"" class=""red"">In February, the unemployment rate had dropped <span id=""16"" class=""yellow"" onclick=""annotateQuant(this);"">to 3.5%,</span> a 50-year low.
</span>— Marina Fang
UN Asks For More Money To Help Poor Countries Fight Virus — 5/7/2020, 6:20 a.m. ET
The U.N. has increased the amount of money it’s asking for to fight the pandemic in poorer countries, <span id=""17"" class=""yellow"" onclick=""annotateQuant(this);"">from $2 billion</span> <span id=""18"" class=""yellow"" onclick=""annotateQuant(this);"">to $6.7 billion</span>. <span id=""11"" class=""red"">Humanitarian chief Mark Lowcock said that while the peak of the pandemic isn’t expected to hit the world’s poorest countries for another three to six months, there is already evidence of job losses and disruption to food supply.
</span><span id=""12"" class=""red"">“Unless we take action now, we should be prepared for a significant rise in conflict, hunger and poverty,” he warned.</span> “The specter of multiple famines looms.”
Since <span id=""19"" class=""yellow"" onclick=""annotateQuant(this);"">March 25,</span> the U.N. has <span id=""20"" class=""yellow"" onclick=""annotateQuant(this);"">raised $1 billion</span> to support efforts <span id=""21"" class=""yellow"" onclick=""annotateQuant(this);"">across 37 fragile</span> countries, The Associated Press reports.
— Liza Hearon
For earlier updates on the pandemic, go here.
<span id=""13"" class=""red"">- What happens if we end social distancing too soon?
- What you need to know about face masks right now
- Will there be a second stimulus check?
- Lost your job due to coronavirus?</span> Here’s what you need to know.
- Why it takes so long to make a coronavirus vaccine
- Parenting during the coronavirus crisis?
- The HuffPost guide to working from home
- What coronavirus questions are on your mind right now? We want to help you find answers.
-
Everyone deserves accurate information about COVID-19. Support journalism without a paywall — and keep it free for everyone — by becoming a HuffPost member today.",,,,,,,0,,,1,,,,,,,,1,,,,,,,,,,,
60b964cbdd0817815f7c3d32,43854,"<h3>Senate Immigration Backers Target Ways to Win Support</h3>As floodwaters finally retreat, officials must contend with tens of thousands unable to return to their homes

Sept.<span id=""0"" class=""yellow"" onclick=""annotateQuant(this);""> 17,</span><span id=""1"" class=""yellow"" onclick=""annotateQuant(this);""> 2017 3</span>:11 pm ET

HOUSTON—Lillian Godfrey has been sleeping on an air mattress on the floor of her friend’s shuttered night club, alongside her daughter and two pool tables, ever since floodwaters swept into her home here last month.

Ms. Godfrey,<span id=""2"" class=""yellow"" onclick=""annotateQuant(this);""> 74 years</span> old, has a federal voucher for a hotel, but hasn’t had any luck finding a room nearby. Her daughter’s cars were lost in the flooding.

“It’s heartbreaking,” she said. “The Lord closes some doors and opens others. He’s going to pull me through this sooner or later.”

As the floodwaters finally retreat across Texas, federal and local officials are now grappling with another vexing problem wrought by Hurricane Harvey: where to house one of the largest populations displaced by a natural disaster in recent years.

Tens of thousands of Texans are still unable to return to their flood-affected homes. Hotel occupancy in the Houston area has surged. <span id=""0"" class=""red"">And disaster recovery officials are scrambling to figure out short-term and permanent housing for those left homeless by the storm—a daunting and costly mission that could take months.

</span><span id=""1"" class=""red"">“While the final scope and scale of the housing challenge is still being realized, it is already apparent that this will be one of the largest, most complex efforts ever undertaken,” said Michael Byrne, who is heading up relief efforts in Texas for the Federal Emergency Management Agency.

</span>As of Saturday night, more <span id=""3"" class=""yellow"" onclick=""annotateQuant(this);"">than 66,000 people</span> who fled the storm were staying in hotels paid for with FEMA vouchers, the agency said. <span id=""2"" class=""red""><span id=""4"" class=""yellow"" onclick=""annotateQuant(this);"">Some 46,120 homeowners</span> and renters who were forced to relocate have also gotten approved by FEMA for financial assistance to help them with housing payments.

</span>More <span id=""5"" class=""yellow"" onclick=""annotateQuant(this);"">than 4,700 people</span> remained in Red Cross shelters across Texas on Saturday night, according to the relief group.

Others, uneasy with the prospect of living elsewhere, have remained in their waterlogged homes. Still others were staying with friends, family or even strangers.

It is still unclear how many people in Texas will lose their homes because of the storm or how many eventually will be able to move back.

According to data culled by the state from cities and counties, an <span id=""6"" class=""yellow"" onclick=""annotateQuant(this);"">estimated 50,712 homes</span> suffered major damage in the storm,<span id=""7"" class=""yellow"" onclick=""annotateQuant(this);""> 14,952 were</span> destroyed <span id=""8"" class=""yellow"" onclick=""annotateQuant(this);"">and 76,364 saw</span> minor damage.

According to local officials, at <span id=""9"" class=""yellow"" onclick=""annotateQuant(this);"">least 130,000 single</span>-family homes in Harris County, which includes Houston, were estimated to have been affected by the rampant flooding here in some way. <span id=""10"" class=""yellow"" onclick=""annotateQuant(this);"">Between 2,000 and</span><span id=""11"" class=""yellow"" onclick=""annotateQuant(this);""> 3,000 large</span> apartment buildings likely sustained damage, and up <span id=""12"" class=""yellow"" onclick=""annotateQuant(this);"">to 5,000 smaller</span> apartment buildings may have been damaged as well, according to officials.

<span id=""3"" class=""red"">“In terms of the sheer destruction due to the flooding, this is unprecedented in modern times for Houston,” said Tom McCasland, Houston’s director of housing and community development.

</span>Mr. McCasland said a sweeping effort is under way—involving city workers, volunteers and FEMA—to figure out which homes were still livable and repair them swiftly. The city is also working to locate any available apartment units that could house evacuees. Similar efforts were under way in flood-ravaged communities throughout Texas.

<span id=""4"" class=""red"">Cities in particular face significant challenges in the wake of disasters such as hurricanes Harvey and Irma because the housing costs in metropolitan areas are higher, there is little empty space for setting up temporary homes such as trailers, and hotel rooms can be scarce, experts said.

</span>For the first full week of September, hotel occupancy in Houston grew <span id=""13"" class=""yellow"" onclick=""annotateQuant(this);"">to 80.5%,</span> more <span id=""14"" class=""yellow"" onclick=""annotateQuant(this);"">than 44% higher</span> than the occupancy rate during the same week a year earlier, according to STR Inc., a data company that tracks the hotel industry.

<span id=""5"" class=""red"">In Port Arthur, a coastal city of <span id=""15"" class=""yellow"" onclick=""annotateQuant(this);"">about 55,000,</span> Mayor Derrick Freeman called the housing situation “dire” in the wake of heavy flooding damage.

</span>This past week, one shelter at a middle school was full after the city’s main shelter had flooded weeks earlier, and <span id=""16"" class=""yellow"" onclick=""annotateQuant(this);"">some 250 people</span> had been evicted from their homes by landlords because of flood damage, according to Mr. Freeman.

Another several hundred were being housed at shelters around the state, and <span id=""17"" class=""yellow"" onclick=""annotateQuant(this);"">between 4,000 and</span><span id=""18"" class=""yellow"" onclick=""annotateQuant(this);""> 5,000 people</span> were still living in flood-damaged homes, Mr. Freeman said.

He had initially hoped to <span id=""19"" class=""yellow"" onclick=""annotateQuant(this);"">get 600 people</span> temporarily housed on two barges that a private company was going to transport from nearby Louisiana.

But, by Friday, the plans had shifted, and large air-conditioned tents were brought in by FEMA and the state to house the evacuees who had been sheltering at the school, he said.

“There are folks here who are really in survival mode,” said Mr. Freeman, whose own home was swamped with water and has been living with his wife and four children at his mother’s home.

Debby Valsin, a 54-year-old retiree, had been living at the middle school shelter in Port Arthur with her nine-year-old grandson. She said her landlord terminated her lease after the floods because her apartment was uninhabitable, giving her five days to haul out her belongings.

Ms. Valsin qualifies for a FEMA hotel voucher but said all the nearby hotels she called are full. For now, with the start of school Monday, Ms. Valsin expected to be moved from the shelter into the tents.

“Your life is upside down,” she said. “I don’t have anything to start over.”

Chris Kirkham contributed to this article.

<span id=""6"" class=""red"">Write to Dan Frosch at dan.frosch@wsj.com and Laura Kusisto at laura.kusisto@wsj.com

87990cbe856818d5eddac44c7b1cdeb8

Appeared in the <span id=""20"" class=""yellow"" onclick=""annotateQuant(this);"">September 18,</span><span id=""21"" class=""yellow"" onclick=""annotateQuant(this);""> 2017,</span> print edition as 'Housing Crunch Afflicts Texas'.</span>",,,,,,,0,,,1,,,,3,,,,,,,,,,,,,,,
