hcastano,26962_10,"“This is another knock for global markets and, taken together, it’s a pretty toxic environment.” China’s currency, the renminbi, which has been a casualty of Mr. Trump’s trade policies for weeks, also weakened further against the dollar on Monday. The government in Beijing, which keeps a firm grip on the value of its currency, weakened the renminbi <span>by 0.34 percent</span> against the dollar, setting the benchmark rate for trading in Shanghai at its weakest level in 15 months. China’s main stock index lost nearly 2 percent at one point on Monday, but it closed down 0.3 percent.",,,,,,,,,0,,,,,,,9,,,,,,,2,,,,,,
hcastano,57262_10,"But only a minority of Americans have assets beyond homes, cars and retirement savings. About 15% of households own stocks, <span>and 13% hold</span> business equity or other residential property, according to Federal Reserve data. Beyond Jackson Hole, per capita assets have skyrocketed in places like Manhattan, Westchester and Nassau in New York, and California’s Palm Beach and the San Francisco Bay Area.",,,,,,,,,0,,,,,,,,1,,,,,,2,,,,,,
hcastano,90349_9,"One more message from his testimony : Mr. Powell doesn't expect the factors weighing down inflation to repeat themselves. He will tell lawmakers that he expects inflation to move up this year and stabilize around the Fed’<span>s 2% objective</span> “over the medium term,” and that “wages should increase at a faster pace as well.” After running below the Fed’s target for years, recent economic data suggests price pressures are finally starting to firm. Mr. Powell noted monthly inflation readings were “a little higher” at the end of 2017 than earlier months, and said he continues to view the inflation shortfall as “likely reflecting transitory influences that we do not expect will repeat.” After years of lackluster wage growth, Americans may soon see faster increases in the size of their paychecks, he said.",,,,,,,,,0,,,,,,3,,,,,,,,2,,,,,,
hcastano,14797_5,"Since its last meeting, economic data have been mixed. Jobs data for July were strong—payrolls <span>rose 255,000</span>—but retail sales and inflation indicators for the month were soft, leaving open the possibility of a prolonged Fed divide that could further delay the next rate move. Despite the mixed economic backdrop, some notable officials this week have sought to remind investors that the time for another rate increase was drawing near.",,,,,,,,,0,,,,,,,,,,,0,,,,0,,,,,
hcastano,95609_6,"It has previously used such language to signal that fresh action is imminent. The ECB’s next policy meeting is on Sept.<span> 12.</span> “It now increasingly looks as if the September meeting will not only bring a single measure but rather a package of several measures,” ING Bank analysts said.",,,,,,,6,,,,,,,,,,,12,,,4,,,,,,,,
hcastano,50136_5,"WHILE YOU WERE SLEEPING: — “American-led airstrikes killed at least 180 Islamic State fighters as local Kurdish forces scrambled to repel a bold, multi-pronged assault by the militants,” Missy Ryan and Loveday Morris report from Iraq. — Ahead of tomorrow night’s Democratic debate, a fresh Washington Post-ABC News poll shows Clinton with a 2-1 edge over Sanders in the national race:<span> 59 percent</span> of Democratic-leaning registered voters support her, compared to 28 percent for him. He’s down from 34 percent in November.",,,,,,,6,,,,,,,,,,,12,,,4,,,,,,,,
hcastano,16030_26,"She last wrote about the psychologist Walter Mischel. Related Coverage - Decades on the Job, and Counting Feb.<span> 21,</span> 2019 - The $15 Minimum Wage Doesn’t Just Improve Lives, It Saves Them Feb. 21, 2019 - The Rise of the WeWorking Class Feb. 21, 2019 - America’s Professional Elite: Wealthy, Successful and Miserable Feb. 21, 2019 - The New Labor Movement Fighting for Domestic Workers’ Rights Feb. 21, 2019 - Why Aren’t Women Advancing More in Corporate America? Feb. 21, 2019",,,,,,,6,,,,,,,,,,,12,,,4,,,,,,,,
hcastano,85751_2,"Lower rates stand to make mortgages more affordable for buyers  Updated May 30, 2019 1:37 pm ET  Mortgage rates dropped <span>below 4% for</span> the first time since early last year, adding to hopes for a revival in the housing market. The average rate this week on a 30-year fixed rate mortgage was at 3.99%, mortgage finance giant Freddie Mac said Thursday.",,,,,,,,,0,,,,,2,,,,,,,,,,0,,,,,
hcastano,63152_19,"Staunch G.O.P. Roots She was born Phyllis McAlpin Stewart on Aug. 15,<span> 1924,</span> in St. Louis, the oldest of two daughters of the former Odile Dodge, a teacher with two college degrees, and John Bruce Stewart, a machinist and industrial equipment salesman who was 17 years his wife’s senior. Fired by Westinghouse at the onset of the Depression, Mr. Stewart was never quite able to put the family’s finances back together.",,,,,,,6,,,,,,,,,,,12,,,4,,,,,,,,
hcastano,13915_1,"U.S. markets wrapped up one of their messiest-ever weeks Friday, recording their worst finish since the 2008 financial crisis. The Standard & Poor’<span>s 500 tumbled</span> 15 percent from where it began Monday, with stocks wrenched all week in hourly spasms as investors tried to fathom where the coronavirus will eventually leave the U.S. economy. The craziness ran right up to the closing bell, with the S&P and the Dow Jones industrial average plunging more than 3 percent minutes after the World Health Organization warned that global health systems were “collapsing” under the strain of the pandemic.",,,,,,,6,,,,,,,,,,,12,,,4,,,,,,,,
hcastano,13006_3,1. Seahawks say no to Kaepernick |<span> 2.</span> Next for Kaepernick?,,,,,,,6,,,,,,,,,,,12,,,4,,,,,,,,
hcastano,3307_1,"season arrives Sunday with what fans hope will be a fitting climax to a wild playoffs, with the Cincinnati Bengals and the Los Angeles Rams facing off in the Super Bowl. The Bengals are in their first Super Bowl <span>in 33 years</span>, led by the rising star quarterback Joe Burrow, who in college won a Heisman Trophy and a national championship with Louisiana State. The Rams have constructed a powerful team through trades and acquisitions, including swapping quarterback Jared Goff for Matthew Stafford in the off-season, and building around the pass rusher Aaron Donald on defense.",,,,,,,6,,,,,,,,,,,12,,,4,,,,,,,,
hcastano,28210_1,"The Houston Astros took four years to mutate from baseball’s worst team to its best. But even at their lowest point, as they stumbled to a franchise-record 111 losses <span>in 2013,</span> they constantly emphasized their brand of ambition. Everywhere they went that season, the Astros took an upright, game show-style spinning wheel for their clubhouse.",,,,,,,6,,,,,,,,,,,12,,,4,,,,,,,,
hcastano,45383_13,"They spoke Mandarin and Hindi and Japanese and Turkish, code-switching to English to answer questions from The Post. According to 2017 estimates from the American Community Survey, Palo Alto is 75.8 percent white, 31.3 percent Asian, <span>and 1.2 percent</span> black, a similar demographic breakdown to most tech companies. Practical information about the Old Palo Alto Halloween event spreads by word of mouth, social media and private messaging apps.",,,,,,,6,,,,,,,,,,,12,,,4,,,,,,,,
hcastano,4331_14,"The group, known as OPEC Plus, appears to have decided during a teleconference that there was no reason to alter policy amid the many uncertainties in the oil market. On Monday, the European Union will begin an embargo on Russian oil, while the Group of 7 industrialized nations and their allies are imposing a price cap <span>of $60 a</span> barrel on Russian crude. The looming embargo and the price cap were the chief reasons for the producers’ group to hold its fire.",,,,,,,,2,,,,,,,,,,12,,,4,,,,,,,,
hcastano,63507_7,"The disparate views among Mr. Trump’s top trade advisers have prompted sparring — both publicly and behind the scenes. In <span>late 2017,</span> when Mr. Lighthizer grew concerned that Mr. Mnuchin and Wilbur Ross, the commerce secretary, were wading too far into China matters, he enlisted Rob Porter, the president’s staff secretary at the time, to persuade Mr. Trump to draft a document designating Mr. Lighthizer the main trade emissary to China, according to a person who has seen the letter. Mr. Lighthizer has never used the document to defend his position, the person said, but he considers it an insurance policy of sorts.",,,,,,,6,,,,,,,,,,,12,,,4,,,,,,,,
hcastano,26248_10,"Inflation is on the rise. The measure of inflation, called ""core consumer price index,"" in April increased to its highest level <span>in 13 years</span>, to 4.1%, and this is after an increase to 2.6% in March, which was the highest level since 2018. These increased measures of inflation are showing up even before a ""full"" reopening of normal activity across the U.S. economy.",,,,,,,6,,,,,,,,,,,12,,,4,,,,,,,,
hcastano,19694_10,"Stock prices for some 3-D printing companies more than doubled in 2013, while world-wide revenue increased a smaller 27% to an estimated $2.8 billion last year, according to consultancy Wohlers Associates Inc. in Colorado. 3-D stocks though are off to a rough start this year with industry leaders 3D Systems Corp. <span>DDD 1.66</span>%increase; green up pointing triangle down 40% and Stratasys Ltd. SSYS -1.48%decrease; red down pointing triangle off about 19% since the start of 2014. Still, some 3-D stocks remain priced at 50 to 70 times projected 2014 earnings, attracting comparisons to the overheated market for Internet stocks during the early 2000s.",,,,,,,,,,1,,,,,,,,12,,,4,,,,,,,,
hcastano,40013_12,"The pain has been greatest in economies where dollar strength has been even more pronounced. In Brazil, gasoline is <span>up 28% and</span> diesel fuel for trucks more than 27% over the past year. The Brazilian real has fallen 11% this year against the dollar.",,,,,,,6,,,,,,,,,,,12,,,4,,,,,,,,
hcastano,Economic-Article-Quant-Annotation-instructions1_example.html,instructions1_example,,,,,,,,,,,,,,,,,,,,,,,,,,,,,"The highlighted quantity should have a general type. Please label the type, or select 'Not Relevant' is a date or otherwise not relevant to the U.S. economy:::Macroeconomic / General Economic Conditions (e.g., discusses jobs, housing prices, and oil prices)"
hcastano,37452_1,"Moderna said the mean antibody level of participants in its study was 1.8 times higher after the booster than it was after the second shot. In another measurement, the booster raised neutralizing antibodies at least fourfold <span>in 87.9 percent</span> of people compared to after the second dose, narrowly failing to meet the agency’s requirement of 88.4 percent. Given that Moderna’s vaccine appears to still strongly protect against severe disease, at least some committee members are expected to balk at recommending a third dose.",,,,,,,6,,,,,,,,,,,12,,,4,,,,,,,,
hcastano,72580_3,"It was a brutal drubbing for investors who had stacked up bets that the U.K. would choose to stay. The pound traded as low <span>as $1.3230 in</span> London’s early hours, as a pink-fringed dawn rose over the city and the British Broadcasting Corp. called the referendum for Leave. That was the lowest level against the dollar since 1985, and an epic move for a developed-market currency.",,,,,,,,,0,,,,,,,9,,,,,,1,,,,,,,
hcastano,74760_27,"The study found that average pay for top businesses leaders at the country’s 350 largest companies amounted to 1$ million per year or more than $17 million when the realized value of stock options are factored in. Meanwhile the minimum wage at the federal level has remained unchanged since 2009, <span>at $7.25 an</span> hour. Although some state governments have taken the lead on raising the floor to upwards of $15.",,,,,,,,,0,,,4,,,,,,,,,,1,,,,,,,
hcastano,14797_6,"Most Fed officials expect growth to pick up in the second half of the year, but several still harbor doubt, especially because inflation has run below the Fed’s target for so long. The Labor Department reported Tuesday that the Consumer Price Index was unchanged in July and <span>up 0.9% from</span> a year earlier. The previous three months it was up 1.1% from a year earlier.",,,,,,,,,0,,,,,,3,,,,,,,,2,,,,,,
hcastano,7188_5,"Although the White House and its allies in the media have attempted to blame ongoing inflation issues on Russian President Vladimir Putin because of his invasion of Ukraine, inflation reports indicated record levels of increase in February, prior to the invasion. Even in Dec. 2021, months before the Ukraine invasion, inflation rose by 6.8%, the largest single increase in <span>almost 40 years</span>. Gas prices have also reached record averages of over $4 a gallon.",,,,,,,6,,,,,,,,,,,12,,,4,,,,,,,,
hcastano,37452_11,"Rates of severe illness were 6.5-fold lower for those 60 years or older and threefold lower for those aged 40 to 60, the researchers said. Death rates were nearly fivefold lower for those <span>aged 60 and</span> up. The Israeli results have been published by a preprint service but have not been peer-reviewed.",,,,,,,6,,,,,,,,,,,12,,,4,,,,,,,,
hcastano,66212_16,"With about 10% of votes counted, he led with about 86% of the vote. Next up in races to watch: Polls close at 7:30 in North Carolina <span>and 8 p</span>.m. in Pennsylvania. Polls close in Idaho at 10 p.m.",,,,,,,6,,,,,,,,,,,12,,,4,,,,,,,,
hcastano,63152_18,"Staunch G.O.P. Roots She was born Phyllis McAlpin Stewart on Aug.<span> 15,</span> 1924, in St. Louis, the oldest of two daughters of the former Odile Dodge, a teacher with two college degrees, and John Bruce Stewart, a machinist and industrial equipment salesman who was 17 years his wife’s senior. Fired by Westinghouse at the onset of the Depression, Mr. Stewart was never quite able to put the family’s finances back together.",,,,,,,6,,,,,,,,,,,12,,,4,,,,,,,,
hcastano,11692_11,"Yields fall as prices rise. WINNERS & LOSERS See a list of <span>the 100 best</span>- and worst-performing publicly traded companies in the first quarter, ranked by percentage gains or losses. - Overall Stock Market: 1st Quarter - New York Stock Exchange: 1st Quarter - Nasdaq Stock Market: 1st Quarter - NYSE MKT: 1st Quarter - NYSE Arca: 1st Quarter - Most Actives: 1st Quarter - Industry Groups: 1st Quarter - Global Stock Indexes: 1st Quarter There are signs that the coming vote has cast a chill over capital markets as well.",,,,,,,6,,,,,,,,,,,12,,,4,,,,,,,,
hcastano,89039_4,"His election to parliament in April was the first time a liberal had been elected from his district in Busan, the country's second-largest city. His campaign is trying to <span>reach 40% support</span> in the province for the presidential race, a spokeswoman said, exceeding what a liberal candidate has done before. Ms. Park, 60, entered politics in 1997.",,,,,,,6,,,,,,,,,,,12,,,4,,,,,,,,
hcastano,61044_13,"Yields on junk bonds recently fell below 6% for the first time ever. Meanwhile, leveraged-loan mutual funds and exchange-traded funds had inflows of $1.2 billion in the week ended Feb.<span> 6,</span> the biggest ever, according to fund tracker Lipper, whose records go back to 1992. Issuance from pools of leveraged loans that sell securities backed by the debt, called collateralized loan obligations, is expected to reach $80 billion this year, according to estimates from Royal Bank of Scotland.",,,,,,,6,,,,,,,,,,,12,,,4,,,,,,,,
hcastano,46412_7,"The S&P 500 dropped 46.88 points, or 1.7%, to 2658.69 on Friday. A dip <span>of 0.8% next</span> week would put it in correction territory for the first time since February. The Dow Jones Industrial Average declined 296.24 points, or 1.2%, to 24688.31.",,,,,,,,,0,,,,,,,,1,,,,,1,,,,,,,
